"£3,500 pcm","7 Lyell Street, London, E14",Apartment,/properties/136208276#/?channel=RES_LET,3
"£2,500 pcm","Hampstead Garden Suburb, London, NW11",Flat,/properties/136208159#/?channel=RES_LET,3
"£2,200 pcm","Dursley Road, London, SE3",Semi-Detached,/properties/136208171#/?channel=RES_LET,3
"£2,975 pcm","Battersea Park Road, London, SW8",Flat,/properties/135601901#/?channel=RES_LET,2
"£3,150 pcm","Campden Hill Towers, 112, Notting Hill Gate, London W11 3QW",Duplex,/properties/136208084#/?channel=RES_LET,2
"£2,000 pcm","Hadleigh Apartments, Woodberry Down, Finsbury Park, N4",Apartment,/properties/136208030#/?channel=RES_LET,1
"£2,200 pcm","Stanhope Road, Highgate",Apartment,/properties/133280612#/?channel=RES_LET,2
"£1,850 pcm","Boulcott Street, Limehouse, London, E1",Apartment,/properties/136207835#/?channel=RES_LET,1
£800 pcm,"18 Fishermans Drive, London, SE16",Parking,/properties/134662457#/?channel=RES_LET,1
"£3,748 pcm","Clifden Road, Clapton, London, E5 0LN",Terraced,/properties/136207814#/?channel=RES_LET,4
"£2,817 pcm","Leigh Street, London, WC1H",Flat,/properties/135350909#/?channel=RES_LET,2
"£2,400 pcm","Clapham Junction, London, SW11",Flat,/properties/136206761#/?channel=RES_LET,2
"£1,625 pcm","Ambassador Square, Isle of dogs, Docklands, London, E14",Apartment,/properties/119853578#/?channel=RES_LET,1
"£3,250 pcm","Westferry Road,Canary Wharf, London, E14",Terraced,/properties/136206431#/?channel=RES_LET,3
"£3,450 pcm","Oakley Square, NW1",Flat,/properties/135498584#/?channel=RES_LET,3
"£2,000 pcm","Fairlight Road, London, SW17",Maisonette,/properties/136206341#/?channel=RES_LET,2
"£4,797 pcm","Abell House, 31 John Islip Street, SW1P",Apartment,/properties/136152614#/?channel=RES_LET,2
"£6,067 pcm","Portland Place, Regents Park, W1B",Apartment,/properties/132063809#/?channel=RES_LET,1
"£5,200 pcm","Ferry Street, Isle of dogs, Docklands, London, E14",Town House,/properties/136205585#/?channel=RES_LET,5
"£24,917 pcm","Kensington Gate, Kensington, W8",Terraced,/properties/136205516#/?channel=RES_LET,5
"£1,600 pcm","Bartlett Mews, London, E14",Flat,/properties/136205507#/?channel=RES_LET,1
"£2,900 pcm","Harrow Road, London, W9",Flat,/properties/136205495#/?channel=RES_LET,3
"£2,401 pcm","Coldharbour Lane, London, SE5",Apartment,/properties/136118711#/?channel=RES_LET,2
"£1,950 pcm","Amelia Street, London, SE17",Flat,/properties/136205501#/?channel=RES_LET,1
"£1,350 pcm","Beechcroft Road, South Woodford, E18",Flat,/properties/136205189#/?channel=RES_LET,1
"£3,790 pcm","Westferry Circus, London, E14",Apartment,/properties/135975143#/?channel=RES_LET,2
"£6,500 pcm","Cockspur Street, St James's, London, SW1Y",Flat,/properties/136204499#/?channel=RES_LET,3
"£6,067 pcm","Cockspur Street, St James's, London, SW1Y",Flat,/properties/136204496#/?channel=RES_LET,3
"£3,034 pcm","Worple Road, Wimbledon, London, SW19",Flat,/properties/136204508#/?channel=RES_LET,1
"£10,833 pcm","Menelik Road, West Hampstead, London, NW2",Semi-Detached,/properties/136204502#/?channel=RES_LET,6
"£4,797 pcm","John Islip Street, Westminster",Flat,/properties/134792906#/?channel=RES_LET,2
"£2,000 pcm","Petram House, Elephant and Castle, London, SE17",Flat,/properties/136204487#/?channel=RES_LET,1
"£3,000 pcm","Holmbury Court, Tooting Bec, London, SW17",Flat,/properties/136204481#/?channel=RES_LET,3
"£1,595 pcm","Streatham Green, Streatham, London, SW16",Flat,/properties/136204472#/?channel=RES_LET,1
"£3,879 pcm","Alexandra Place, South Hampstead, London, NW8",Flat,/properties/136204466#/?channel=RES_LET,3
"£2,492 pcm","Great Peter Street, Victoria, London, SW1P",Flat,/properties/136204409#/?channel=RES_LET,2
"£2,650 pcm","Gordon Road, Nunhead, London, SE15",Flat,/properties/136204406#/?channel=RES_LET,2
"£2,400 pcm","Camberwell Road, Camberwell, London, SE5",Flat,/properties/136204400#/?channel=RES_LET,2
"£2,250 pcm","LEIGHAM COURT ROAD,, Streatham, London, SW16",Flat,/properties/135516101#/?channel=RES_LET,2
"£3,012 pcm","Clanricarde Gardens, Notting Hill, London, W2",Flat,/properties/136204397#/?channel=RES_LET,2
"£2,817 pcm","Ryders Terrace, St John's Wood, London, NW8",Mews,/properties/133143911#/?channel=RES_LET,2
"£2,167 pcm","Philbeach Gardens, Earls Court, London, SW5",Apartment,/properties/136204343#/?channel=RES_LET,1
"£2,275 pcm","Dorset Street, Marylebone, London, W1U",Studio,/properties/136204292#/?channel=RES_LET,1
"£2,384 pcm","Gloucester Place, Regent's Park, London, NW1",Studio,/properties/136204298#/?channel=RES_LET,1
"£11,050 pcm","Bourdon Street, Mayfair, London, W1K",Flat,/properties/136204301#/?channel=RES_LET,2
"£4,250 pcm","Brecon Road, London, W6",Terraced,/properties/136204274#/?channel=RES_LET,3
"£1,712 pcm","Harrow Road, W9, Maida Vale, London, W9",Flat,/properties/136204265#/?channel=RES_LET,1
"£2,817 pcm","St. Pancras Chambers, Euston Road, London, NW1",Apartment,/properties/135857261#/?channel=RES_LET,2
"£2,235 pcm","Haverstock Place, Angel, London, N1",Flat,/properties/136204238#/?channel=RES_LET,1
"£2,275 pcm","Copenhagen Street, Islington, London, N1",Flat,/properties/136204241#/?channel=RES_LET,1
"£2,579 pcm","Agincourt Road, Hampstead, London, NW3",Flat,/properties/136204226#/?channel=RES_LET,2
"£3,900 pcm","Agincourt Road, Hampstead, London, NW3",Flat,/properties/136204229#/?channel=RES_LET,2
"£3,450 pcm","River Gardens Walk, Greenwich, London, SE10",Flat,/properties/136204196#/?channel=RES_LET,3
"£4,600 pcm","Purcell Crescent, Fulham, London, SW6",House,/properties/136204178#/?channel=RES_LET,4
"£2,275 pcm","Central Avenue, Fulham, London, SW6",Flat,/properties/136204175#/?channel=RES_LET,1
"£7,800 pcm","Cato Street, W1H, Marylebone, London, W1H",Terraced,/properties/132185723#/?channel=RES_LET,3
"£3,300 pcm","Southwark Bridge Road, Elephant and Castle, SE1",Flat,/properties/136204166#/?channel=RES_LET,2
"£2,800 pcm","Summerstown, Summerstown, LONDON, SW17",Flat,/properties/136204163#/?channel=RES_LET,1
"£2,000 pcm","Central Way, Park Royal, London, NW10",Flat,/properties/136204151#/?channel=RES_LET,2
"£2,709 pcm","Philbeach Gardens, Earls Court, London, SW5",Flat,/properties/136204154#/?channel=RES_LET,1
"£1,950 pcm","Tollington Road, Islington, London, N7",Flat,/properties/86126484#/?channel=RES_LET,1
"£2,350 pcm","Chiswick High Road, Chiswick, London, W4",Flat,/properties/136204124#/?channel=RES_LET,3
"£3,684 pcm","City Road, Old Street, London, EC1V",Flat,/properties/136204127#/?channel=RES_LET,2
"£6,067 pcm","City Road, Old Street, London, EC1V",Flat,/properties/136204130#/?channel=RES_LET,2
"£2,579 pcm","Canary South, Canary Wharf, London, E14",Flat,/properties/136204079#/?channel=RES_LET,2
"£2,900 pcm","Walworth Road, London, SE1",Flat,/properties/136203944#/?channel=RES_LET,2
"£4,200 pcm","Kinross House, London, N1",Flat,/properties/136203953#/?channel=RES_LET,4
"£2,150 pcm","Stracey Road, London, E7",Terraced,/properties/136203959#/?channel=RES_LET,3
"£2,145 pcm","Printers Road, Stockwell, London, SW9",Flat,/properties/136203917#/?channel=RES_LET,1
"£2,300 pcm","Crutchley Road, SE6, Catford, London, SE6",Terraced,/properties/136203869#/?channel=RES_LET,3
"£2,200 pcm","George Lane, Hither Green, London, SE13",Flat,/properties/136203863#/?channel=RES_LET,3
"£3,250 pcm","Queenstown Road, Battersea Park, London, SW11",Flat,/properties/136203785#/?channel=RES_LET,2
"£1,278 pcm","Carnation Way, Thames City, SW8",Studio,/properties/136191134#/?channel=RES_LET,4
"£1,800 pcm","Batten Street, Battersea, London, SW11",Flat,/properties/136203776#/?channel=RES_LET,1
"£1,604 pcm","Connaught Heights, Silvertown, London, E16",Flat,/properties/134049959#/?channel=RES_LET,1
"£6,717 pcm","St. Annes Court, London, W1F",Terraced,/properties/136004618#/?channel=RES_LET,3
"£2,492 pcm","Kildare Terrace, Notting Hill",Flat,/properties/136203710#/?channel=RES_LET,1
£850 pcm,"Chase Road, Southgate",Flat,/properties/136203620#/?channel=RES_LET,N/A
"£2,900 pcm","Wanley Road, East Dulwich",House,/properties/135970319#/?channel=RES_LET,4
"£2,600 pcm","Soldene Court, Georges Road, N7",Apartment,/properties/136203536#/?channel=RES_LET,3
"£3,100 pcm","Latymer Court, Hammersmith Road, Hammersmith, W6",Flat,/properties/136203539#/?channel=RES_LET,3
"£4,767 pcm","Ferry Street, Isle of dogs, Docklands, London, E14",Terraced,/properties/136203521#/?channel=RES_LET,5
"£4,100 pcm","Fountain Park Way, White City Living, W12 7JT",Apartment,/properties/136203500#/?channel=RES_LET,2
"£2,700 pcm","Jubilee Street, London, E1",Flat,/properties/136203404#/?channel=RES_LET,3
"£1,750 pcm",Timbercroft Lane London SE18,Terraced,/properties/136203359#/?channel=RES_LET,2
"£4,500 pcm","Barnsbury Terrace, 
Islington Central, N1",Flat,/properties/136203278#/?channel=RES_LET,1
"£2,100 pcm","Black Prince Road, Vauxhall, SE11",Flat,/properties/136203251#/?channel=RES_LET,2
"£1,650 pcm","Earlsfield Road, Earlsfield",Flat,/properties/136203065#/?channel=RES_LET,1
"£2,000 pcm","Fairfield Drive, SW18",Ground Flat,/properties/136203035#/?channel=RES_LET,2
"£8,233 pcm","The Tower, St George Wharf",Apartment,/properties/134487317#/?channel=RES_LET,3
"£2,000 pcm","Leith Close, London, NW9",Maisonette,/properties/136202780#/?channel=RES_LET,2
"£2,383 pcm","Caledonian Road, Caledonian Road N7",Flat,/properties/136202459#/?channel=RES_LET,2
"£2,999 pcm","Lillian Avenue, Acton",House,/properties/136202363#/?channel=RES_LET,3
"£2,000 pcm",The Woodlands London SE19,Flat,/properties/136202252#/?channel=RES_LET,3
"£2,799 pcm","Black Prince Road, Albert Embankment",Flat,/properties/136202111#/?channel=RES_LET,2
"£1,842 pcm","Judd Street, London",Flat,/properties/135904175#/?channel=RES_LET,1
"£3,501 pcm","Spectrum Way, SW18",Apartment,/properties/136202102#/?channel=RES_LET,2
"£3,900 pcm","004B, 7 Vanguard Way, London, E17 6ZR",Apartment,/properties/133865153#/?channel=RES_LET,2
"£1,800 pcm","High Street, Crouch End, London, N8",Apartment,/properties/136202027#/?channel=RES_LET,2
"£2,350 pcm",Bathurst Gardens London NW10,Flat,/properties/136201997#/?channel=RES_LET,3
"£1,600 pcm",Conington Road Lewisham SE13,Flat,/properties/136201949#/?channel=RES_LET,1
"£1,300 pcm","John Strachey House, London, SW6",Studio,/properties/136201904#/?channel=RES_LET,1
"£2,495 pcm","Nunhead Lane, London, SE15",Flat,/properties/136201907#/?channel=RES_LET,3
£622 pcm,"Rachel Mcmillan Student Village, London, SE8",Flat Share,/properties/136201829#/?channel=RES_LET,1
"£9,317 pcm","St Mary Abbots Terrace, Kensington, W14",Terraced,/properties/104614985#/?channel=RES_LET,5
"£3,000 pcm","Eynsford House, London, SE17",Flat,/properties/136201766#/?channel=RES_LET,4
"£6,283 pcm","9 Millbank Quater, London, SW1P",Flat,/properties/134959061#/?channel=RES_LET,2
"£3,185 pcm","Dorigen Court, Lisgar Terrace, London",Flat,/properties/136201643#/?channel=RES_LET,2
"£2,350 pcm","No.4, Upper Riverside, Cutter Lane, Greenwich Peninsula, SE10",Apartment,/properties/136201607#/?channel=RES_LET,1
"£2,300 pcm","Burwood Place, London, W2",Apartment,/properties/135918593#/?channel=RES_LET,1
"£1,950 pcm","Boundary Street, Shoreditch, London, E2",Apartment,/properties/136201556#/?channel=RES_LET,1
"£1,600 pcm","St Marys Road, Nunhead",Apartment,/properties/136201469#/?channel=RES_LET,1
"£1,350 pcm",Davids Road London SE23,Flat,/properties/136201472#/?channel=RES_LET,1
"£1,100 pcm",Steep Hill,Flat,/properties/136201406#/?channel=RES_LET,1
"£2,950 pcm","Roman Road, Bethnal Green, E2",Maisonette,/properties/136201388#/?channel=RES_LET,3
"£3,012 pcm","Warren House, Beckford Close, Kensington, W14",Flat,/properties/136201364#/?channel=RES_LET,2
"£4,000 pcm","Evershot Road, N4 3BB",Apartment,/properties/136198523#/?channel=RES_LET,4
"£3,300 pcm","Atelier Point, London, E15",Flat,/properties/135568685#/?channel=RES_LET,2
"£3,300 pcm","Pater Street, London, W8",Flat,/properties/135126725#/?channel=RES_LET,2
"£4,100 pcm","Lillie Road, London, SW6",Flat,/properties/135993389#/?channel=RES_LET,4
"£2,383 pcm","Grange Road, London, SE1",Flat,/properties/136201199#/?channel=RES_LET,1
"£1,450 pcm",Lawrie Park Road London SE26,Flat,/properties/136201082#/?channel=RES_LET,1
"£2,015 pcm",Marloes Road Kensington W8,Flat,/properties/131812769#/?channel=RES_LET,1
"£3,185 pcm","Moore House, Gatliff Road, Grosvenor Waterside",Apartment,/properties/135387422#/?channel=RES_LET,1
"£2,799 pcm",Selsdon Way,Flat,/properties/136200992#/?channel=RES_LET,2
"£3,250 pcm","Hepworth Court , Gatliff Road, Grosvenor Waterside",Apartment,/properties/135302513#/?channel=RES_LET,1
"£4,250 pcm","Sheridan Road, London, SW19",Semi-Detached,/properties/136200905#/?channel=RES_LET,5
"£3,000 pcm","Octavia House, 
Medway Street, SW1P",Flat,/properties/136200815#/?channel=RES_LET,2
"£3,250 pcm","Micklethwaite Road, 
Fulham, SW6",Maisonette,/properties/136200803#/?channel=RES_LET,3
£867 pcm,"Court Yard House, Rotherhithe New Road, Surrey Quays, SE16",Studio,/properties/136200683#/?channel=RES_LET,N/A
"£2,700 pcm","Yale Court, Honeybourne Road, West Hampstead, NW6",Apartment,/properties/136200686#/?channel=RES_LET,2
"£1,950 pcm","Belsize Road, West Hampstead, NW6",Apartment,/properties/136200692#/?channel=RES_LET,2
"£3,450 pcm","Popham Street, Angel, Islington, London, N1",Apartment,/properties/135527531#/?channel=RES_LET,3
"£3,900 pcm","Popham Street, Angel, Islington, London, N1",Apartment,/properties/135999941#/?channel=RES_LET,3
"£3,950 pcm","BBC Television, Wood Lane, W12 7TQ",Apartment,/properties/136200557#/?channel=RES_LET,2
"£1,900 pcm","Torrent Lodge, SE10",Flat,/properties/136200503#/?channel=RES_LET,1
£900 pcm,"The Crescent, Walthamstow",Flat Share,/properties/136200497#/?channel=RES_LET,1
"£3,575 pcm","Sawley Road , Shepherds Bush W12",Terraced,/properties/136200458#/?channel=RES_LET,4
"£1,600 pcm","Cornell Square, LONDON",Apartment,/properties/136200395#/?channel=RES_LET,2
"£1,993 pcm","56 Bloemfontein Road, London",Apartment,/properties/136200302#/?channel=RES_LET,1
"£3,250 pcm","Plimsoll Building, Handyside Street, Kings Cross",Apartment,/properties/135111560#/?channel=RES_LET,1
"£1,599 pcm","Beaufort Square, London, NW9",Studio,/properties/136199528#/?channel=RES_LET,1
"£1,750 pcm","Woodstock Avenue, Golders Green, NW11",Flat,/properties/135125984#/?channel=RES_LET,2
"£3,100 pcm","No.2, Upper Riverside, Cutter Lane, Greenwich Peninsula, SE10",Apartment,/properties/136200134#/?channel=RES_LET,2
"£3,400 pcm","Eagle Point, City Road, London",Apartment,/properties/136200038#/?channel=RES_LET,2
"£1,800 pcm","Woburn Place, WC1H",Flat,/properties/136200020#/?channel=RES_LET,1
"£2,000 pcm",Otley Court London N11,Apartment,/properties/136200014#/?channel=RES_LET,2
"£1,746 pcm","Perilla House 17 Stable Walk , London",Flat,/properties/136195631#/?channel=RES_LET,2
"£2,102 pcm","Bridgewater House, City Island, Canning Town, E14",Apartment,/properties/136199831#/?channel=RES_LET,1
"£1,950 pcm","Greyhound Road, Hammersmith, London, W6",Flat,/properties/136199837#/?channel=RES_LET,2
"£7,583 pcm",Oval Road Primrose Hill NW1,Flat,/properties/136199603#/?channel=RES_LET,3
"£2,500 pcm","Forest Drive, Manor Park E12",Terraced,/properties/136199495#/?channel=RES_LET,3
"£2,708 pcm","Aylesford Street, 
Pimlico, SW1V",Flat,/properties/136199459#/?channel=RES_LET,2
"£2,708 pcm","York Way, Kings Cross",Flat,/properties/134010350#/?channel=RES_LET,1
"£1,850 pcm","High Street Colliers Wood, London SW19",Flat,/properties/136199387#/?channel=RES_LET,2
"£3,150 pcm","Empire Square West, London SE1",Apartment,/properties/136199306#/?channel=RES_LET,2
"£3,195 pcm","Cherry Park Lane, London, E20",Apartment,/properties/136197395#/?channel=RES_LET,2
"£1,800 pcm",Cavendish Road NW6,Apartment,/properties/136199183#/?channel=RES_LET,2
"£8,499 pcm",Beavor Lane London W6,House,/properties/136199180#/?channel=RES_LET,4
"£1,320 pcm","High Road, London, N22",Flat,/properties/136199027#/?channel=RES_LET,1
"£1,798 pcm","Bootmakers Court, Ben Jonson Road, Limehouse, London",Flat,/properties/136199153#/?channel=RES_LET,1
"£2,999 pcm","Jardine Road, Wapping",Flat,/properties/136199114#/?channel=RES_LET,3
"£2,500 pcm","Sterling Mansions, Leman Street, Aldgate, London, E1",Apartment,/properties/136199108#/?channel=RES_LET,1
"£4,875 pcm","Circus Lodge, Circus Road, London, NW8",Apartment,/properties/135756980#/?channel=RES_LET,2
"£3,250 pcm","Coventry Street, London, Greater London, W1D",Apartment,/properties/136198928#/?channel=RES_LET,2
"£1,600 pcm","Belsize Grove, London",Studio,/properties/136198922#/?channel=RES_LET,1
"£3,500 pcm","Vulcan Close, London",House,/properties/136198892#/?channel=RES_LET,4
"£2,700 pcm","4 Heath Parade, Graham Park Way, Colindale, NW9",Flat,/properties/136198865#/?channel=RES_LET,3
"£2,600 pcm","Abercorn Place, St John's Wood",Flat,/properties/136198775#/?channel=RES_LET,1
"£1,850 pcm","Glenthorne Road, Hammersmith",Flat,/properties/136198787#/?channel=RES_LET,1
"£1,675 pcm","Durham Road, N2 9DR",Flat,/properties/135228263#/?channel=RES_LET,1
"£2,500 pcm","Finchely Road, London, NW3",Apartment,/properties/136198760#/?channel=RES_LET,2
"£2,275 pcm",2 Woolwich Church Street Woolwich SE18,Terraced,/properties/136200692#/?channel=RES_LET,2
"£6,500 pcm","Casson Square, London, SE1",Apartment,/properties/136198730#/?channel=RES_LET,2
"£1,350 pcm","The Broadway, London, E4",Apartment,/properties/74471846#/?channel=RES_LET,1
"£2,600 pcm","Transenna Works, London, N1",Flat,/properties/136198487#/?channel=RES_LET,1
"£1,600 pcm","Mapeshill Place, London, NW2",Flat,/properties/136198478#/?channel=RES_LET,1
"£2,500 pcm","Denison House, 20 Lanterns Way, London, E14",Apartment,/properties/136198433#/?channel=RES_LET,2
"£3,600 pcm","Ashfield Rd, Haringey, London, N4",Terraced,/properties/136198412#/?channel=RES_LET,4
"£2,000 pcm","Headlam Street, London, E1",Flat,/properties/136198409#/?channel=RES_LET,1
"£3,033 pcm","Gloucester Terrace, London, W2",Flat,/properties/136198394#/?channel=RES_LET,2
"£1,900 pcm","Kingfisher Street, London, E6",Semi-Detached,/properties/136198376#/?channel=RES_LET,3
"£4,000 pcm","Bayview House, Enfield, EN2",Detached,/properties/136198361#/?channel=RES_LET,3
"£2,200 pcm","Iceland Wharf, London, SE16",Flat,/properties/136198358#/?channel=RES_LET,2
"£2,250 pcm","Earlsfield House, London, SW18",Flat,/properties/136198343#/?channel=RES_LET,2
"£2,250 pcm","Earlsfield House, London, SW18",Flat,/properties/136198340#/?channel=RES_LET,2
"£2,750 pcm","Earlsfield House, London, SW18",Flat,/properties/136198337#/?channel=RES_LET,2
"£2,600 pcm","Millharbour, London, E14",Flat,/properties/136198313#/?channel=RES_LET,2
"£2,999 pcm","Jardine Road, Wapping",Flat,/properties/136198157#/?channel=RES_LET,3
"£8,502 pcm","Beavor Lane, Hammersmith",Terraced,/properties/135315809#/?channel=RES_LET,4
"£5,700 pcm","Tachbrook Street, 
Pimlico, SW1V",House,/properties/136197917#/?channel=RES_LET,4
"£2,100 pcm","Belvedere Place, London, SW2",Apartment,/properties/134372987#/?channel=RES_LET,2
"£3,011 pcm","Rosslyn Hill, London, NW3",Apartment,/properties/136197806#/?channel=RES_LET,2
"£1,850 pcm","Oval Mansions, London, SE11",Flat,/properties/136004501#/?channel=RES_LET,1
"£3,142 pcm","Coventry Street, Soho, W1D",Apartment,/properties/136197773#/?channel=RES_LET,2
"£5,000 pcm","William Hunt Mansions, 4 Somerville Avenue, London, SW13",Apartment,/properties/136197764#/?channel=RES_LET,3
"£2,145 pcm","Strode Road, London, NW10",Apartment,/properties/136197722#/?channel=RES_LET,2
"£3,250 pcm","Southwalk Bridge Road, London, SE1",Flat,/properties/135621608#/?channel=RES_LET,4
"£1,600 pcm",Whitehorse Lane London SE25,Flat,/properties/136197716#/?channel=RES_LET,2
"£1,900 pcm","Buckhold Road, Wandsworth",Flat,/properties/136197620#/?channel=RES_LET,1
"£1,750 pcm","Blackheath Hill, London, SE10",Flat,/properties/136197593#/?channel=RES_LET,1
"£2,925 pcm","Casson Square, Waterloo, Southbank Place, London, SE1",Apartment,/properties/136197545#/?channel=RES_LET,1
"£4,000 pcm","Fulham Road, South Kensington, SW3",Flat,/properties/132914090#/?channel=RES_LET,2
"£2,750 pcm","Heathfield Road, London, W3",Flat,/properties/136197470#/?channel=RES_LET,2
"£1,300 pcm","Aspen House, Winchmore Hill, London, N21",Flat,/properties/135246500#/?channel=RES_LET,1
"£1,400 pcm","City View House, Bethnal Green Road, London",Studio,/properties/136197314#/?channel=RES_LET,1
"£1,100 pcm","High Road, Leyton",Flat,/properties/136197215#/?channel=RES_LET,1
"£1,150 pcm",Woolwich Road London SE7,Studio,/properties/136197128#/?channel=RES_LET,1
"£3,199 pcm","Cherry Park Lane, London, E20",Apartment,/properties/136196267#/?channel=RES_LET,2
"£1,175 pcm","Gordon Road, Ealing, London, W13",Apartment,/properties/136198049#/?channel=RES_LET,1
"£3,012 pcm","Crastock Court     Queens Gardens, London",Flat,/properties/136197101#/?channel=RES_LET,1
"£2,145 pcm","Queensway, London W2",Flat,/properties/136197098#/?channel=RES_LET,1
"£3,000 pcm",Battersea Power Station London SW11,Flat,/properties/136197038#/?channel=RES_LET,1
"£1,798 pcm","St Peters Square, St Peters Conservation Area, Hammersmith, W6",Flat,/properties/136196888#/?channel=RES_LET,1
"£1,850 pcm",Dukes Avenue London N10,Apartment,/properties/136196810#/?channel=RES_LET,2
"£2,300 pcm","No.2, Upper Riverside, Cutter Lane, Greenwich Peninsula, SE10",Apartment,/properties/135179564#/?channel=RES_LET,1
"£1,250 pcm","Hornsey Park Road, London, N8",Studio,/properties/136196759#/?channel=RES_LET,N/A
"£1,750 pcm","Winchester Avenue, Queens Park, NW6",Flat,/properties/136196738#/?channel=RES_LET,1
"£4,797 pcm","Abell House, 31 John Islip Street, London, SW1P",Apartment,/properties/135573011#/?channel=RES_LET,2
"£3,900 pcm","Old Compton Street, Soho, W1D",Flat,/properties/136196648#/?channel=RES_LET,1
"£1,733 pcm","Amhurst Road, London E8",Flat,/properties/134997821#/?channel=RES_LET,1
"£8,667 pcm","Fernhurst Road, 
Fulham, SW6",Terraced,/properties/136237559#/?channel=RES_LET,5
"£1,712 pcm","Stratford Road, London, W8",Apartment,/properties/136130396#/?channel=RES_LET,2
"£2,925 pcm","Kings Road, 
Chelsea, SW3",Flat,/properties/136196600#/?channel=RES_LET,2
"£4,000 pcm","Jamestown Way, Atlantic Court ",Apartment,/properties/136196573#/?channel=RES_LET,3
"£2,600 pcm","Duke Of Wellington Avenue, Woolwich, London, SE18",Flat,/properties/136196558#/?channel=RES_LET,2
"£1,192 pcm","Barquentine Heights,4 Peartree Way, Greenwich, SE10",House Share,/properties/136196540#/?channel=RES_LET,N/A
"£1,235 pcm","Barquentine Heights,4 Peartree Way, Greenwich, SE10",House Share,/properties/136196543#/?channel=RES_LET,N/A
"£1,400 pcm","Mount Pleasant Crescent, N4 4HP",Apartment,/properties/136196480#/?channel=RES_LET,1
"£3,467 pcm","Egerton Gardens Mews, Knightsbridge, SW3",Apartment,/properties/136196501#/?channel=RES_LET,2
"£1,898 pcm","Middle Road, London, W7",Flat,/properties/136196525#/?channel=RES_LET,1
"£2,295 pcm","Highgate Hill, London, N19",Flat,/properties/136195361#/?channel=RES_LET,2
"£1,898 pcm","Middle Road, London, W7",Flat,/properties/136196471#/?channel=RES_LET,1
"£5,742 pcm","The Sherwood, Soho, London, W1F",Flat,/properties/136196441#/?channel=RES_LET,1
"£7,500 pcm","Clover Mews, London, SW3",Mews,/properties/136196411#/?channel=RES_LET,2
"£1,950 pcm","Tanner Street, London, SE1",Apartment,/properties/136196375#/?channel=RES_LET,1
"£2,400 pcm","Gateway Tower, 28 Western Gateway, Royal Victoria, London, E16",Apartment,/properties/136196327#/?channel=RES_LET,2
"£2,999 pcm","The Colonnades, Bayswater",Flat,/properties/136196237#/?channel=RES_LET,2
"£3,488 pcm",Tantallon House,Apartment,/properties/136196183#/?channel=RES_LET,2
"£2,500 pcm","Burnell Building, Cricklewood, NW2",Flat,/properties/136196177#/?channel=RES_LET,3
"£1,755 pcm","Baltic Apartments, Western Gateway, Royal Victoria Docks, Canary Wharf, London, E16 1AE",Apartment,/properties/136196153#/?channel=RES_LET,1
"£2,500 pcm","Kimberley Road, Brixton",Flat,/properties/136196096#/?channel=RES_LET,2
"£2,200 pcm",Bowen Drive London SE7,Flat,/properties/136196099#/?channel=RES_LET,2
"£5,612 pcm","The Sherwood, Soho, London, W1F",Flat,/properties/136196042#/?channel=RES_LET,2
"£7,583 pcm","Oval Road, Regents Park NW1",Flat,/properties/136196054#/?channel=RES_LET,3
"£1,755 pcm","Westgate Apartments, 14 Western Gateway, Excel, Royal Victoria Docks, London, E16 1BN",Apartment,/properties/136196024#/?channel=RES_LET,1
"£2,167 pcm","Ibex House, 1 Forest Lane, Stratford, Olympic Village, London, E15 1HR",Flat,/properties/136195856#/?channel=RES_LET,2
"£5,055 pcm",Mast Quay Woolwich Church Street Woolwich SE18,Detached,/properties/135938405#/?channel=RES_LET,3
"£1,499 pcm","(Retail Shop With A1, A2) High Road Leyton, E10",Plot,/properties/135771002#/?channel=COM_LET,N/A
"£1,703 pcm","Bickley Street, Tooting Broadway, SW17",Flat,/properties/136195781#/?channel=RES_LET,1
"£1,777 pcm","Dorrington Point, Bromley High Street, Bow, London, E3 3EL",Flat,/properties/136195778#/?channel=RES_LET,1
"£2,999 pcm","King Street, Hammersmith, London, W6",Flat,/properties/136195754#/?channel=RES_LET,4
"£1,777 pcm","Clematis Apartments, Merchant Street, Mile End, Bow, City, London, E3 4PQ",Flat,/properties/136195748#/?channel=RES_LET,1
"£1,898 pcm","Belgrave Road, Wembley, London, HA0  1 Bed Flat",Flat,/properties/136195760#/?channel=RES_LET,1
"£1,875 pcm","Fairlead House, London, E14",Apartment,/properties/134730644#/?channel=RES_LET,2
"£1,160 pcm","Walworth Road, London, SE17",Studio,/properties/136177355#/?channel=RES_LET,N/A
