"£5,250 pcm","Newark House, Loughborough Junction",Flat,/properties/86194638#/?channel=RES_LET,4
"£1,600 pcm","Bulwer Court Road, London",Ground Flat,/properties/136242707#/?channel=RES_LET,2
"£2,900 pcm","Vandome Close, Custom House, London, E16",House,/properties/135790637#/?channel=RES_LET,4
"£1,900 pcm","Royal Tower Lodge, Cartwright Street, St Katherine Docks, E1",Flat,/properties/123122660#/?channel=RES_LET,1
"£2,390 pcm","Arlingford Road, London, SW2",Terraced,/properties/136242695#/?channel=RES_LET,2
"£3,500 pcm","Beechcroft Avenue, London, NW11",Flat,/properties/136242698#/?channel=RES_LET,4
£525 pcm,"Orpington Road, London, N21",Flat Share,/properties/136242677#/?channel=RES_LET,1
"£3,995 pcm","Camden Road, London, NW1",Flat,/properties/136242689#/?channel=RES_LET,3
"£1,600 pcm","High Street, London, E15",Flat Share,/properties/135979148#/?channel=RES_LET,1
"£2,708 pcm","Canalside Walk, London, W2",Flat,/properties/134965898#/?channel=RES_LET,1
"£1,100 pcm","Rye Lane, LONDON",Apartment,/properties/136242653#/?channel=RES_LET,1
"£1,500 pcm","Old Kent Road, LONDON",Apartment,/properties/136242650#/?channel=RES_LET,2
"£2,500 pcm","Parkhurst Court, Warlters Road, London, N7",Apartment,/properties/136242632#/?channel=RES_LET,3
"£2,500 pcm","Parkhurst Court, Warlters Road, London, N7",Apartment,/properties/136242617#/?channel=RES_LET,3
"£7,500 pcm","Brecknock Road, Tufnell Park, London, N19",House,/properties/136242596#/?channel=RES_LET,6
"£1,750 pcm","Girdlestone Walk,, Archway, London, N19",Apartment,/properties/136242548#/?channel=RES_LET,1
"£1,998 pcm","Flat 003 Empire Heights, 45 New Cross Road, London, SE14",Flat,/properties/136242488#/?channel=RES_LET,2
"£1,995 pcm","Liberty Street, London, SW9",Flat,/properties/136242530#/?channel=RES_LET,1
"£2,200 pcm","Uncle New Cross, Batavia Road, London, SE14",Flat,/properties/136242476#/?channel=RES_LET,2
"£3,358 pcm","Mount Pleasant, London, WC1X",Flat,/properties/86127723#/?channel=RES_LET,1
"£2,400 pcm","Uncle New Cross, Batavia Road, London, SE14",Flat,/properties/136242449#/?channel=RES_LET,2
"£2,995 pcm","Henderson Road, Forest Gate, London, E7",House,/properties/136242107#/?channel=RES_LET,5
"£1,067 pcm","Green Lanes, London, N4",Studio,/properties/136241405#/?channel=RES_LET,1
"£1,700 pcm","Riverdale House, Lewisham, London, SE13",Flat,/properties/136241417#/?channel=RES_LET,1
"£1,800 pcm","Seymore Mews, London, SE14",Flat,/properties/136241387#/?channel=RES_LET,2
"£1,800 pcm","Martlett Court, Covent Garden, WC2B",Flat,/properties/136091105#/?channel=RES_LET,1
"£1,900 pcm","Hazeltree Lodge, London, N13",Flat,/properties/136241357#/?channel=RES_LET,2
"£1,950 pcm","Sterling Gardens, London, SE14",Flat,/properties/136241363#/?channel=RES_LET,2
"£5,000 pcm","Princes Park Avenue, London, NW11",Semi-Detached,/properties/136241345#/?channel=RES_LET,4
"£3,400 pcm","Hungerford Road, London, N7",Maisonette,/properties/136241351#/?channel=RES_LET,4
"£2,800 pcm","Reed Place, London, SW4",Flat,/properties/136241306#/?channel=RES_LET,2
"£2,200 pcm","Clapham Road, London, SW9",Flat,/properties/136241315#/?channel=RES_LET,2
"£1,750 pcm","Gordon Road, London, N3",Flat,/properties/136241321#/?channel=RES_LET,2
"£3,100 pcm","Troon Street, London, E1",Semi-Detached,/properties/136241288#/?channel=RES_LET,3
"£2,600 pcm","Nora Gardens, London, NW4",End of Terrace,/properties/136241282#/?channel=RES_LET,3
£925 pcm,"Mathews Park Avenue, London, E15",House Share,/properties/136241264#/?channel=RES_LET,1
"£2,150 pcm","Webber Street, London, SE1 0JN",Flat,/properties/136240196#/?channel=RES_LET,1
"£3,500 pcm","Lodge Lane, London, N12",End of Terrace,/properties/136240148#/?channel=RES_LET,3
"£1,250 pcm","Schoolhouse Yard, London, SE18",Flat,/properties/136240151#/?channel=RES_LET,1
"£2,600 pcm","Garrick Avenue, Golders Green",House,/properties/134010539#/?channel=RES_LET,4
£875 pcm,"Brook Road, London, NW2",House Share,/properties/86196144#/?channel=RES_LET,1
"£2,800 pcm","King Street *Short Term Rental Property*, London, N2",Flat,/properties/134787410#/?channel=RES_LET,1
"£3,000 pcm","Churchill Road, London",Terraced,/properties/136239977#/?channel=RES_LET,3
"£4,502 pcm","The Broadway, London",Detached,/properties/136239905#/?channel=RES_LET,N/A
"£2,400 pcm","Roderick Road, London",Flat,/properties/136239929#/?channel=RES_LET,2
"£4,000 pcm","Upwood Road, London, SE12",Detached,/properties/136239893#/?channel=RES_LET,5
"£1,195 pcm","Ground Floor, London, N16",Flat,/properties/136239890#/?channel=RES_LET,1
"£4,770 pcm","Perilla House, London, E1",Flat,/properties/136239884#/?channel=RES_LET,2
"£2,150 pcm","London, London, N1",Flat,/properties/136239875#/?channel=RES_LET,2
"£2,750 pcm","Sidney Road, London, SW9",Flat,/properties/136239872#/?channel=RES_LET,3
£95 pcm,"Heath Rise, Kersfield Road, London, SW15",Semi-Detached,/properties/132049808#/?channel=RES_LET,1
"£1,975 pcm","Ground Floor, London, N6",Flat,/properties/136239863#/?channel=RES_LET,2
"£2,700 pcm","Cambalt House, London, SW15",Flat,/properties/136239860#/?channel=RES_LET,2
"£1,700 pcm","Heylyn Square, London, E3",Flat,/properties/136239857#/?channel=RES_LET,1
"£2,200 pcm","Old Kent Road, London, SE1",Flat,/properties/136239845#/?channel=RES_LET,2
"£4,263 pcm","Daubeney Road, London, E5",Semi-Detached,/properties/136152389#/?channel=RES_LET,3
"£1,950 pcm","Maygrove Road, London, NW6",Flat,/properties/135985022#/?channel=RES_LET,1
"£3,000 pcm",Whites Square London SW4,Flat,/properties/136239740#/?channel=RES_LET,3
"£3,003 pcm",136 Jim Griffiths Clem Attlee Court ,Flat,/properties/136239680#/?channel=RES_LET,4
"£3,501 pcm",14 Parkleigh Court,Flat,/properties/136239686#/?channel=RES_LET,5
"£3,306 pcm","Lancaster Court, London",Flat,/properties/136239674#/?channel=RES_LET,3
"£1,603 pcm",301 Clarence Lane SW15 5QA,Flat,/properties/136239662#/?channel=RES_LET,1
"£2,199 pcm","Siege House, London, E1",Flat,/properties/136239308#/?channel=RES_LET,2
"£1,650 pcm","Kilburn High Road, London, NW6",Flat,/properties/136239305#/?channel=RES_LET,1
"£1,200 pcm","Charcot Road, London, NW9",Flat Share,/properties/135983813#/?channel=RES_LET,1
"£2,167 pcm","Buckler Court, 
Eden Grove, N7",Flat,/properties/136238585#/?channel=RES_LET,1
"£6,000 pcm",Clapham Common North Side London SW4,Apartment,/properties/136238573#/?channel=RES_LET,3
"£2,400 pcm","High Street, London, E15",Flat,/properties/136238537#/?channel=RES_LET,2
"£3,500 pcm","Regan Way, London, N1",Flat,/properties/136238531#/?channel=RES_LET,4
"£4,600 pcm","Osnaburgh Street, London, NW1",Flat,/properties/136238528#/?channel=RES_LET,4
"£2,000 pcm","Wolsey Street, London, E1",Flat,/properties/136238525#/?channel=RES_LET,2
"£1,950 pcm","Caravel Close, London, E14",Flat,/properties/135828782#/?channel=RES_LET,2
"£1,798 pcm","The Burroughs, Hendon, NW4",Studio,/properties/136238396#/?channel=RES_LET,1
"£3,050 pcm","Finsbury Park, London, N4",Flat,/properties/136238342#/?channel=RES_LET,3
"£2,400 pcm","Brook Road, London, NW2",Apartment,/properties/136237331#/?channel=RES_LET,2
"£2,999 pcm","Ashenden Road, Homerton, E5",Apartment,/properties/136190234#/?channel=RES_LET,2
"£4,333 pcm","Vicargae Gate, Kensington, W8",Flat,/properties/136237532#/?channel=RES_LET,1
"£2,100 pcm","Library Building, St Lukes Avenue, Clapham Common SW4",Flat,/properties/136237274#/?channel=RES_LET,1
"£2,200 pcm",Bedford Road London SW4,Flat,/properties/136237244#/?channel=RES_LET,2
"£2,395 pcm","Wayside Close, London, N14",Maisonette,/properties/136237220#/?channel=RES_LET,3
"£1,950 pcm",Dundee Wharf Three Colt Street Limehouse,Apartment,/properties/136237178#/?channel=RES_LET,1
"£5,417 pcm","Sherwood Street, London, W1F",Apartment,/properties/131718500#/?channel=RES_LET,2
"£2,500 pcm","Green Lane, SW16",Semi-Detached,/properties/130612640#/?channel=RES_LET,3
"£1,695 pcm","Victoria Road, Walthamstow",Apartment,/properties/136236536#/?channel=RES_LET,2
"£1,600 pcm","Flat 2, 25 Spencer Road",Flat,/properties/136236170#/?channel=RES_LET,1
"£1,200 pcm","Palace Gates Road, London, N22",Apartment,/properties/136236137#/?channel=RES_LET,1
"£1,895 pcm","Moira Court, London, SW17",Flat,/properties/136236128#/?channel=RES_LET,2
"£1,800 pcm"," Dumont Road, London",Flat,/properties/136235714#/?channel=RES_LET,1
"£3,990 pcm","Macfarlane Road, London, W12",Flat,/properties/136233140#/?channel=RES_LET,4
"£2,750 pcm","King Edward's Road, London Fields E9",Apartment,/properties/136232909#/?channel=RES_LET,2
"£3,350 pcm","Lockgate Rd, London, SW6",Flat,/properties/136072844#/?channel=RES_LET,2
"£2,584 pcm","Eastwood Street, London, SW16",Flat,/properties/136232585#/?channel=RES_LET,2
"£6,283 pcm","Haverstock Hill, Belsize Park NW3 ",Flat,/properties/136231517#/?channel=RES_LET,3
"£2,150 pcm","Queenstown Road, London",Apartment,/properties/136139072#/?channel=RES_LET,1
"£1,650 pcm","Stoke Newington, Hackney, London, N16",Flat,/properties/136230896#/?channel=RES_LET,1
"£2,097 pcm","Holst House, Du Cane Road, London, W12",Apartment,/properties/136230308#/?channel=RES_LET,2
"£1,846 pcm","Cobbold Road, London, W12",Apartment,/properties/136230311#/?channel=RES_LET,1
"£1,750 pcm","Maltings Place, Tennyson Court, London, SW6",Flat,/properties/136230272#/?channel=RES_LET,2
"£2,200 pcm","Rowallan Road, London, SW6",Flat,/properties/136230269#/?channel=RES_LET,2
"£2,500 pcm","Old Swan Wharf, 116 Battersea Church Road, London, SW11",Flat,/properties/136230260#/?channel=RES_LET,2
"£2,400 pcm","St. Mary Le Park, Battersea",Apartment,/properties/135941726#/?channel=RES_LET,1
"£3,750 pcm","Holloway Road, London, N19",Terraced,/properties/86179890#/?channel=RES_LET,4
"£1,425 pcm",Lawrence Road,Studio,/properties/136230230#/?channel=RES_LET,1
"£3,000 pcm","The Lockhouse, London, NW1",Flat,/properties/135975245#/?channel=RES_LET,1
"£1,275 pcm","52 Aerodrome Road, London, NW9",Apartment,/properties/136229723#/?channel=RES_LET,1
"£1,690 pcm","Amesbury Avenue, London, SW2",Flat,/properties/136229714#/?channel=RES_LET,2
"£3,750 pcm","Spitfire Building, N1",Penthouse,/properties/135575237#/?channel=RES_LET,2
"£3,200 pcm","Scylla Road, London, SE15",Semi-Detached,/properties/136229405#/?channel=RES_LET,3
"£2,000 pcm","High Road, London, N12",Flat,/properties/136229411#/?channel=RES_LET,3
"£2,220 pcm","Harvard Road, London, SE13",Terraced,/properties/136229414#/?channel=RES_LET,3
"£2,350 pcm","Vauxhall Bridge Road, London, SW1V",Flat,/properties/136229417#/?channel=RES_LET,2
"£1,550 pcm","Amesbury Avenue, London, SW2",Flat,/properties/136229420#/?channel=RES_LET,1
"£1,500 pcm","Tooting, London, SW17",Flat,/properties/135984761#/?channel=RES_LET,1
"£5,113 pcm","Kensington High Street, London, W14",Flat,/properties/135490481#/?channel=RES_LET,2
"£6,478 pcm","Central Avenue, London, SW6",Penthouse,/properties/136206818#/?channel=RES_LET,2
"£2,600 pcm","Wimbledon Park Road, London, SW19",Flat,/properties/136229330#/?channel=RES_LET,2
"£2,250 pcm","The Merchant Building, London, N1",Flat,/properties/136229279#/?channel=RES_LET,1
"£3,400 pcm","Phoenix Place, London, WC1X",Flat,/properties/136229276#/?channel=RES_LET,1
"£1,325 pcm","Fishguard Way, London, E16",Flat,/properties/136229270#/?channel=RES_LET,1
"£1,595 pcm","Mersey Road, Walthamstow",Apartment,/properties/136229246#/?channel=RES_LET,1
"£2,675 pcm","Hardy Avenue, London, E16",Terraced,/properties/136198271#/?channel=RES_LET,3
"£2,250 pcm","Botolph Alley, London, EC3R",Apartment,/properties/136229135#/?channel=RES_LET,1
"£1,650 pcm","Basing Way, Finchley, London, N3",Apartment,/properties/136229120#/?channel=RES_LET,2
"£3,012 pcm","Kensington Gardens Square, Bayswater, W2",Flat,/properties/136229114#/?channel=RES_LET,2
"£1,750 pcm","Beverley Court, SW20",Apartment,/properties/135723959#/?channel=RES_LET,2
"£3,500 pcm","Queensway, London, W2 3RX, UK",Apartment,/properties/136165496#/?channel=RES_LET,1
"£1,900 pcm","Gordon Court Whitehall Park Road, London, W4",Maisonette,/properties/136229042#/?channel=RES_LET,2
"£2,025 pcm","Blackheath Road, Greenwich, SE10",Flat,/properties/136220192#/?channel=RES_LET,2
"£2,817 pcm","Arthouse, York Way",Flat,/properties/136228766#/?channel=RES_LET,1
"£1,750 pcm","Whetstone Green, London, N20",Flat,/properties/136046939#/?channel=RES_LET,1
"£1,950 pcm","New Road, N22, Tottenham, London, N22",Flat,/properties/136039841#/?channel=RES_LET,2
"£4,500 pcm","Roupell Street, London, SE1",Terraced,/properties/136227545#/?channel=RES_LET,3
"£3,800 pcm","Gunter Grove, London, SW10",Detached,/properties/136227518#/?channel=RES_LET,3
"£2,200 pcm","Mascalls Court, London, SE7",Flat,/properties/136227476#/?channel=RES_LET,3
"£2,600 pcm","Trebovir Road, London, SW5",Flat,/properties/136227377#/?channel=RES_LET,1
"£3,250 pcm","Montrose Building, London, SW11",Flat,/properties/136227383#/?channel=RES_LET,2
"£1,850 pcm","Craig Tower, 1 Aqua Vista Square, Bow, London, E3",Flat,/properties/136227158#/?channel=RES_LET,1
"£2,752 pcm","Discovery Dock Apartments West, Canary Wharf, London, E14",Flat,/properties/136227146#/?channel=RES_LET,2
"£4,250 pcm","Corrance Road, Clapham, London, SW2",Terraced,/properties/136227140#/?channel=RES_LET,4
"£1,650 pcm",Ann Street London SE18,Flat,/properties/136227116#/?channel=RES_LET,2
"£1,898 pcm",New Providence Wharf E14,Flat,/properties/125010023#/?channel=RES_LET,1
"£1,850 pcm","Galleria House, Docklands, London, E16",Flat,/properties/86200887#/?channel=RES_LET,1
"£2,400 pcm",Malton Street London SE18,Terraced,/properties/136226486#/?channel=RES_LET,3
"£1,750 pcm","Devonshire Road, London",Flat,/properties/136226441#/?channel=RES_LET,1
"£1,750 pcm","Godstow Road, Abbey Wood, SE2",Maisonette,/properties/136226432#/?channel=RES_LET,3
"£3,550 pcm","Camley Street, London, N1C",Apartment,/properties/136226420#/?channel=RES_LET,1
"£5,875 pcm","Camley Street, London, N1C",Apartment,/properties/136226414#/?channel=RES_LET,3
"£5,950 pcm","Camley Street, London, N1C",Apartment,/properties/136226411#/?channel=RES_LET,3
"£4,725 pcm","Camley Street, London, N1C",Apartment,/properties/136226408#/?channel=RES_LET,2
"£5,200 pcm","Camley Street, London, N1C",Apartment,/properties/136226399#/?channel=RES_LET,2
"£2,500 pcm","Manor View, Finchley, London, N3",Apartment,/properties/136120016#/?channel=RES_LET,1
"£3,850 pcm","Camley Street, London, N1C",Apartment,/properties/136226387#/?channel=RES_LET,1
"£2,100 pcm","Rainhill Way, Bow, E3",Apartment,/properties/135227846#/?channel=RES_LET,2
"£2,200 pcm","Gough Walk, Poplar, E14",Apartment,/properties/136226375#/?channel=RES_LET,2
"£2,275 pcm","Dance Square, Clerkenwell, London EC1V",Apartment,/properties/136226363#/?channel=RES_LET,1
"£2,708 pcm","Belvedere Row Apartments, White City Living, White City W12",Apartment,/properties/136226354#/?channel=RES_LET,1
"£4,008 pcm","One Crown Place, The City, London EC2A",Apartment,/properties/136226321#/?channel=RES_LET,1
"£2,400 pcm","Warehouse W, Royal Victoria Dock, E16",Apartment,/properties/136226315#/?channel=RES_LET,2
"£2,600 pcm","London Dock, Counter House, Wapping E1W",Apartment,/properties/136226276#/?channel=RES_LET,1
"£2,253 pcm","Wiverton Tower, Aldgate Place, New Drum Street, Aldgate E1",Studio,/properties/136226285#/?channel=RES_LET,1
"£2,492 pcm","Atrium Apartments, Ladbroke Grove, London W10",Apartment,/properties/136226264#/?channel=RES_LET,2
"£2,492 pcm","The Georgette Apartments, The Silk District, Whitechapel E1",Apartment,/properties/136226267#/?channel=RES_LET,1
"£2,197 pcm","Victory Parade, London, SE18",Flat,/properties/136226204#/?channel=RES_LET,2
"£2,708 pcm","Bezier Apartments, City Road, Shoreditch EC1Y",Apartment,/properties/136226207#/?channel=RES_LET,1
"£2,600 pcm","Free Trade Wharf, The Highway, Wapping E1W",Apartment,/properties/136226213#/?channel=RES_LET,2
"£2,375 pcm","Masthead House, London, E16",Flat,/properties/136226219#/?channel=RES_LET,2
"£2,200 pcm","The Oxygen Apartments, Royal Victoria Dock, E16",Apartment,/properties/136226360#/?channel=RES_LET,2
"£3,792 pcm","Catalina House, Goodman's Fields, Aldgate E1",Apartment,/properties/136226198#/?channel=RES_LET,2
"£3,033 pcm","Westmark, West End Gate, Paddington W2",Apartment,/properties/136226195#/?channel=RES_LET,1
"£2,350 pcm","Studley Court, London, E14",Flat,/properties/135876659#/?channel=RES_LET,2
"£1,950 pcm","Westgate Apartments, Royal Victoria Dock, E16",Apartment,/properties/136226036#/?channel=RES_LET,2
"£1,700 pcm","Bruford Court, Deptford, London, SE8",Flat,/properties/136225820#/?channel=RES_LET,2
"£2,297 pcm","Fenner Square, London",Maisonette,/properties/136225613#/?channel=RES_LET,2
"£2,650 pcm","Constable Walk, College Road London SE21",Maisonette,/properties/136225595#/?channel=RES_LET,3
"£6,283 pcm","10 Park Drive, E14",Flat,/properties/136224998#/?channel=RES_LET,3
"£2,249 pcm","Union Wharf, Alder Path, London, SE8",Apartment,/properties/136196183#/?channel=RES_LET,1
"£18,417 pcm","Observatory Gardens, London",Flat,/properties/136224938#/?channel=RES_LET,3
"£2,899 pcm","Moore House , Gatliff Road , Grosvenor Waterside",Apartment,/properties/134487347#/?channel=RES_LET,1
"£3,012 pcm","Hepworth Court, Grosvenor Waterside , Gatliff Road",Apartment,/properties/134487314#/?channel=RES_LET,1
"£4,215 pcm","32 Harbour Way, London, E14",Apartment,/properties/124716989#/?channel=RES_LET,3
"£2,817 pcm","Cubitt Building, Grosvenor Waterside , Gatliff Road",Apartment,/properties/134681291#/?channel=RES_LET,1
"£2,899 pcm","Moore House , Gatliff Road , Grosvenor Waterside",Apartment,/properties/134487383#/?channel=RES_LET,1
"£3,250 pcm","Caro Point, Gatliff Road, Grosvenor Waterside",Apartment,/properties/135793352#/?channel=RES_LET,1
"£3,250 pcm","Cubitt Building , Gatliff Road, Grosvenor Waterside",Apartment,/properties/135166895#/?channel=RES_LET,1
"£4,333 pcm","Landau Apartments, Farm Lane, Fulham",Apartment,/properties/135121340#/?channel=RES_LET,2
"£4,767 pcm","Grosvenor Road, St Georges Square, Pimlico",Apartment,/properties/134913884#/?channel=RES_LET,3
"£5,633 pcm","32 John Islip Street, London",Apartment,/properties/135962852#/?channel=RES_LET,2
"£5,980 pcm","Moore House , Gatliff Road , Grosvenor Waterside",Apartment,/properties/134487308#/?channel=RES_LET,3
"£7,583 pcm",Nova Building,Apartment,/properties/135182345#/?channel=RES_LET,3
"£7,583 pcm","The Tower, 1 St George Wharf, Vauxhall",Apartment,/properties/135053315#/?channel=RES_LET,2
"£29,250 pcm","The Clarges, Ashburton Place, Mayfair",Apartment,/properties/134487302#/?channel=RES_LET,2
"£4,330 pcm","Moore House , Grosvenor Waterside , Gatliff Road",Apartment,/properties/134487332#/?channel=RES_LET,2
"£1,300 pcm","Broadfield Road, Catford, London, SE6",Flat,/properties/136200818#/?channel=RES_LET,1
"£1,900 pcm","Sienna Alto, Cornmill Lane, London, SE13",Flat,/properties/136215110#/?channel=RES_LET,2
"£1,300 pcm","Stocksfield Road, Walthamstow, E17",Apartment,/properties/111316832#/?channel=RES_LET,1
"£1,900 pcm","Compton House, Victory Parade, Royal Arsenal SE18",Apartment,/properties/136224548#/?channel=RES_LET,1
"£4,203 pcm","Cubitt Building, Grosvenor Waterside, Gatliff Road",Apartment,/properties/134778566#/?channel=RES_LET,2
"£1,350 pcm","Mayville Road, Leytonstone, E11",Flat,/properties/85553352#/?channel=RES_LET,1
"£3,250 pcm","2 Fairchild Place, Shoreditch, EC2A",Apartment,/properties/136224440#/?channel=RES_LET,1
"£3,497 pcm","Westbourne Avenue, Acton",House,/properties/136224383#/?channel=RES_LET,3
"£2,250 pcm","Marylands Road, Maida Vale, London, W9",Apartment,/properties/136196888#/?channel=RES_LET,4
"£1,700 pcm","New River Village, Hornsey, N8",Apartment,/properties/136224335#/?channel=RES_LET,1
"£4,008 pcm","Grange Road, Bermondsey",Flat,/properties/136224251#/?channel=RES_LET,2
"£2,650 pcm","Anthems Way, London E20",Flat,/properties/136224242#/?channel=RES_LET,2
"£1,400 pcm","Bodnant Gardens, London",Flat,/properties/136224041#/?channel=RES_LET,1
"£2,817 pcm","Hewett Street, London, EC2A",Apartment,/properties/136223801#/?channel=RES_LET,1
"£1,175 pcm","Felixstowe Road, Abbey Wood, London, SE2 9AQ",Flat,/properties/136223774#/?channel=RES_LET,1
"£2,100 pcm","Longnor Road, London, E1",Maisonette,/properties/136223672#/?channel=RES_LET,2
"£2,500 pcm","Graham Road, London, E8",Flat,/properties/136223666#/?channel=RES_LET,1
"£2,500 pcm","Archery Steps, London, W2",Flat,/properties/136223657#/?channel=RES_LET,1
"£1,300 pcm","Baldry Gardens, Streatham",Flat,/properties/135184475#/?channel=RES_LET,1
"£3,400 pcm","White Chapel  Road, London, E1",Flat,/properties/136099106#/?channel=RES_LET,3
"£6,500 pcm","Pembroke Road, London, W8",Flat,/properties/135832904#/?channel=RES_LET,2
"£2,900 pcm","Queens Drive, London, N4",Flat,/properties/135271724#/?channel=RES_LET,3
"£2,200 pcm","Wightman Road, Turnpike Lane Hornsey, London",Mews,/properties/136223462#/?channel=RES_LET,3
"£1,800 pcm","East End Road, London, N2",Flat,/properties/136223312#/?channel=RES_LET,2
"£2,650 pcm",Lagado Mews London SE16,House,/properties/136223294#/?channel=RES_LET,3
"£2,600 pcm","Bath Terrace, Borough",Flat,/properties/136223300#/?channel=RES_LET,3
"£1,950 pcm","Newington Causeway, Borough",Flat,/properties/136223303#/?channel=RES_LET,2
"£4,995 pcm","Westover Road, Wandsworth, London, SW18",Terraced,/properties/136223213#/?channel=RES_LET,5
"£2,100 pcm","Freeland Road, Ealing Common, W5",Flat,/properties/52740227#/?channel=RES_LET,2
"£1,650 pcm","Kestrel House, 
4 Grant Road, SW11",Flat,/properties/136223114#/?channel=RES_LET,1
"£5,677 pcm","The Tower, St. George Wharf, Vauxhall",Apartment,/properties/135165323#/?channel=RES_LET,2
"£1,750 pcm","Upper Richmond Road, London",Apartment,/properties/136223039#/?channel=RES_LET,N/A
"£2,700 pcm","Dalston Lane, London",Flat,/properties/134397998#/?channel=RES_LET,2
"£3,250 pcm",Winchester Street London SW1V,Flat,/properties/134384516#/?channel=RES_LET,1
"£2,095 pcm","Western Gateway, E16",Apartment,/properties/136222964#/?channel=RES_LET,2
"£2,250 pcm",Clarence Mews London SE16,Apartment,/properties/136222949#/?channel=RES_LET,2
"£2,500 pcm",6 Odessa Street London SE16,Apartment,/properties/136222916#/?channel=RES_LET,2
"£1,800 pcm","Pan Peninsula Square, London",Studio,/properties/135021770#/?channel=RES_LET,1
"£2,600 pcm",Liverpool Grove London SE17,Apartment,/properties/136217336#/?channel=RES_LET,3
"£2,396 pcm","Green Lanes, London, N16",Flat,/properties/136222670#/?channel=RES_LET,2
"£3,300 pcm","Sunbury Lane, 
St. Mary's Park, SW11",Maisonette,/properties/136222724#/?channel=RES_LET,3
"£3,500 pcm","Langley Lane, 
Oval, SW8",Terraced,/properties/136222721#/?channel=RES_LET,3
"£1,195 pcm","Highbridge Court, Farrow Lane, London, SE14",Studio,/properties/136222679#/?channel=RES_LET,1
"£2,000 pcm","Manor Gardens, N7 6JX",Flat,/properties/127874048#/?channel=RES_LET,1
"£1,150 pcm","Water Lane, London, SE14",Apartment,/properties/136222526#/?channel=RES_LET,N/A
"£1,850 pcm","Sherwood Hall, East End Road, N2",Flat,/properties/136222736#/?channel=RES_LET,2
"£2,700 pcm","Trinity Church Square, London Bridge",Flat,/properties/136222481#/?channel=RES_LET,2
"£1,850 pcm",Byrne Road London SW12,Apartment,/properties/136222475#/?channel=RES_LET,1
"£2,747 pcm","Heathfield Road, London, W3",Apartment,/properties/136222241#/?channel=RES_LET,2
"£1,998 pcm","Thermopylae Gate, Canary Wharf",Flat,/properties/136222232#/?channel=RES_LET,2
"£2,675 pcm","Rivington Street, Shoreditch - 2 Bedroom Apartment - Split Level - EC2A - £2,675 PCM ",Duplex,/properties/136222190#/?channel=RES_LET,2
"£2,600 pcm","Xavier Building, 10 Westfield Avenue, London, E20",Apartment,/properties/136221755#/?channel=RES_LET,1
"£1,885 pcm","Bavent Road, London, SE5",Flat,/properties/136221794#/?channel=RES_LET,2
"£1,950 pcm","Norwood Road, London, SE24",Flat,/properties/136221788#/?channel=RES_LET,2
"£1,800 pcm","Kestrel House, London, SE10",Flat,/properties/136221782#/?channel=RES_LET,2
"£1,000 pcm","Studio Flat to let, Goodall Road, Leytonstone, E11 (£1000pcm)",Apartment,/properties/136221749#/?channel=RES_LET,1
"£2,578 pcm","Erasmus Street, Westminster",Flat,/properties/136221743#/?channel=RES_LET,1
"£1,800 pcm","Chingford Avenue, London",Apartment,/properties/135665189#/?channel=RES_LET,3
"£3,600 pcm","St Davids Square, E14",Apartment,/properties/134079389#/?channel=RES_LET,1
"£1,950 pcm","Devonport Street, E1",Flat,/properties/136221734#/?channel=RES_LET,1
"£2,167 pcm",Lever Street,Detached,/properties/136221731#/?channel=RES_LET,2
"£2,605 pcm","Xavier Building, 10 Westfield Avenue, London, E20",Apartment,/properties/136221359#/?channel=RES_LET,1
"£1,590 pcm","Benton's Lane, London, SE27",Flat,/properties/135456347#/?channel=RES_LET,1
"£1,500 pcm","Hanley Road, Finsbury Park",Flat,/properties/136221686#/?channel=RES_LET,1
"£1,350 pcm","Avonley Road, London, SE14",Flat,/properties/122108891#/?channel=RES_LET,1
"£3,215 pcm","Cherry Park Lane, London, E20",Apartment,/properties/136220834#/?channel=RES_LET,2
"£2,899 pcm","99 Blackwall Way, London, E14",Apartment,/properties/136221278#/?channel=RES_LET,3
"£1,800 pcm","Brook Court, Green Pond Road, Walthamstow E17",Flat,/properties/136220846#/?channel=RES_LET,2
"£2,000 pcm","120 Finchley Road, London, NW3 5HT",Studio,/properties/136220840#/?channel=RES_LET,1
£997 pcm,"Elizabeth Close, London, E14 6DW",House Share,/properties/136220864#/?channel=RES_LET,1
"£1,150 pcm","Walworth Road, London, SE17",Studio,/properties/136219667#/?channel=RES_LET,N/A
"£3,235 pcm","Cherry Park Lane, London, E20",Apartment,/properties/136220579#/?channel=RES_LET,2
