"£1,798 pcm","519A Roman Road, Bow, Victoria Park, Bow Quarter, Mile End, London, E3 5EL",Flat,/properties/136195676#/?channel=RES_LET,1
"£3,250 pcm","Cherry Park Lane, London, E20",Apartment,/properties/136194581#/?channel=RES_LET,2
"£5,417 pcm","The Sherwood, Soho, London, W1F",Flat,/properties/136195652#/?channel=RES_LET,2
"£4,117 pcm","Oval Road, Regents Park NW1",Flat,/properties/136195649#/?channel=RES_LET,2
"£2,297 pcm","Icona Point, 58 Warton Road, Stratford, Olympic Village, London, E15 2JD",Flat,/properties/136195637#/?channel=RES_LET,2
"£4,117 pcm","Oval Road, London, NW1",Apartment,/properties/136195631#/?channel=RES_LET,2
"£1,950 pcm","Aurora Building, 164 Blackwall Way, South Quay, Canary Wharf, London, E14 9NZ",Flat,/properties/136195595#/?channel=RES_LET,1
"£4,117 pcm","Oval Road, London",Apartment,/properties/136195568#/?channel=RES_LET,2
"£2,700 pcm","Southey Road, Wimbledon, SW19",Semi-Detached,/properties/136195565#/?channel=RES_LET,3
"£1,950 pcm","Aurora Building, 164 Blackwall Way, Blackwall, Canary Wharf, London, E14 9NZ",Flat,/properties/136195523#/?channel=RES_LET,1
"£2,100 pcm","Devonshire Road, London",Apartment,/properties/123719195#/?channel=RES_LET,3
"£2,150 pcm","Hythe House, 1 Green Lanes Walk, London, N4",Apartment,/properties/136195478#/?channel=RES_LET,1
"£5,000 pcm","Harrods Village, Barnes SW13",Apartment,/properties/136195454#/?channel=RES_LET,3
"£5,750 pcm","Delvino Road, London, SW6",Terraced,/properties/135018065#/?channel=RES_LET,4
"£2,318 pcm","Great Ormond St, Bloomsbury, London, WC1N",Apartment,/properties/86153514#/?channel=RES_LET,1
"£2,750 pcm","Hungerford Road, 
Islington, N7",Flat,/properties/136195400#/?channel=RES_LET,3
"£2,817 pcm","Parliament House, 81 Black Prince Road, London, SE1",Flat,/properties/135620564#/?channel=RES_LET,4
"£1,400 pcm","Downy House, Globe Road, London, E1",Studio,/properties/136193801#/?channel=RES_LET,N/A
"£1,820 pcm","31 Three Colt Street, Westferry, Limehouse, Poplar, London, E14 8HH",Apartment,/properties/136195370#/?channel=RES_LET,1
"£1,690 pcm","Harlesden Road, Willesden",Flat,/properties/136195373#/?channel=RES_LET,2
"£2,102 pcm","Wicklow Street, Kings Cross, WC1X",Apartment,/properties/136123985#/?channel=RES_LET,1
"£2,773 pcm","Leman Street, London, E1",Flat,/properties/136195328#/?channel=RES_LET,2
"£2,300 pcm","Cranston Court, Bloemfontein Road, London, W12",Apartment,/properties/136195313#/?channel=RES_LET,2
"£4,117 pcm","Latitude House, Camden Town",Apartment,/properties/136195292#/?channel=RES_LET,2
"£2,250 pcm","Edith Villas, Bective Road, Putney",Flat,/properties/136195229#/?channel=RES_LET,2
"£3,500 pcm","Nevern Square, Earls Court",Flat,/properties/135723806#/?channel=RES_LET,3
"£4,117 pcm",Latitude House Oval Road NW1,Flat,/properties/136195133#/?channel=RES_LET,2
"£3,600 pcm","Talbot Road, London",Flat,/properties/135848987#/?channel=RES_LET,2
"£1,250 pcm","Drakes Courtyard, Kilburn High Road, NW6",Studio,/properties/134120591#/?channel=RES_LET,1
"£1,810 pcm","Silvertown Way, London, E16",Studio,/properties/136194866#/?channel=RES_LET,1
"£1,777 pcm","Pan Peninsula Square, East Tower, Canary Wharf E14",Studio,/properties/136194821#/?channel=RES_LET,1
"£1,600 pcm","Granary Court, 1 Millstone Close, London, London, E15",Apartment,/properties/127785638#/?channel=RES_LET,1
"£11,267 pcm","The Sherwood, Soho, London, W1F",Flat,/properties/136194797#/?channel=RES_LET,3
"£2,015 pcm","Sulgrave Road, London, W6",Flat,/properties/136194746#/?channel=RES_LET,2
"£4,800 pcm","Abell House, 31 John Islip Street, Westminster, London, SW1P",Apartment,/properties/134834336#/?channel=RES_LET,2
"£1,560 pcm","Cricklewood Lane, LONDON",Apartment,/properties/86183901#/?channel=RES_LET,1
"£1,798 pcm","Manhattan Building, Bow Quarter, 60 Fairfield Road, London, E3 2UL",Apartment,/properties/136194635#/?channel=RES_LET,1
"£2,100 pcm","Forge Square, London",Flat,/properties/136194572#/?channel=RES_LET,2
"£1,798 pcm","11 Oxley Square, St Andrews Development, Bow, Bromley By Bow, Poplar, Devons Road, London, E3 3GR",Apartment,/properties/136194578#/?channel=RES_LET,1
"£2,708 pcm","Mornington Street,  Camden, NW1",Apartment,/properties/107161664#/?channel=RES_LET,3
"£11,483 pcm","704, 12 Sherwood Street, Soho, London, W1F",Flat,/properties/136194542#/?channel=RES_LET,3
"£2,800 pcm","Galleria House, Royal Eden Docks, 12 Western Gateway, Custom House",Flat,/properties/86195463#/?channel=RES_LET,2
"£1,750 pcm","Sovereign Tower, 1 Emily Street, Canning Town, London, E16",Apartment,/properties/136194491#/?channel=RES_LET,1
"£3,000 pcm","Wheatstone House, Chiswick High Road, Chiswick",Apartment,/properties/136194272#/?channel=RES_LET,2
"£3,500 pcm","Benyon Wharf, Kingsland Road, Haggerston, London, E8",Flat,/properties/86163810#/?channel=RES_LET,3
"£2,795 pcm","Albany Street, Regents, London, NW1",Apartment,/properties/136194194#/?channel=RES_LET,2
"£4,100 pcm","Sovereign Court, Wrights Lane, London W8",Flat,/properties/135148439#/?channel=RES_LET,2
"£1,750 pcm","South Woodford, E18",Flat,/properties/136194185#/?channel=RES_LET,2
"£2,817 pcm","68 Queens Gardens, Bayswater, London, W2.",Flat,/properties/136194161#/?channel=RES_LET,2
"£1,750 pcm","Morecambe Close, Stepney Green, London",Apartment,/properties/136194062#/?channel=RES_LET,1
"£2,400 pcm","Landmark Pinnacle, Canary Wharf, E14",Apartment,/properties/136194071#/?channel=RES_LET,1
"£10,183 pcm","Cromwell Place, South Kensington, London",Flat,/properties/136193999#/?channel=RES_LET,2
"£1,750 pcm","Quicks Road, Wimbledon",Apartment,/properties/136193879#/?channel=RES_LET,2
"£1,750 pcm","Rothesay Avenue, Wimbeldon Chase",Maisonette,/properties/60425937#/?channel=RES_LET,2
"£2,968 pcm","Carlisle Street, Soho, W1D",Apartment,/properties/136193681#/?channel=RES_LET,1
"£2,150 pcm","Coombe Hill House, London, SW20",Apartment,/properties/136193627#/?channel=RES_LET,2
"£1,800 pcm","Camden Road, Camden",Flat,/properties/136193618#/?channel=RES_LET,1
"£2,700 pcm","Yeldham Road, London, W6",Flat,/properties/135837902#/?channel=RES_LET,3
"£1,900 pcm","Grand Parade, Green Lanes, London N4 1DX",Flat,/properties/135127877#/?channel=RES_LET,2
"£2,800 pcm","Old Pye Street, SW1P",Apartment,/properties/136193426#/?channel=RES_LET,2
"£14,083 pcm","Beverston Mews, Marylebone",House,/properties/136193417#/?channel=RES_LET,5
"£1,798 pcm","Seymour Place, Marylebone",Studio,/properties/136193408#/?channel=RES_LET,1
"£2,860 pcm",Breathtaking 2 Bed Flat in Fitzrovia W1T,Flat,/properties/136193339#/?channel=RES_LET,2
£950 pcm,"Cheniston Gardens, High Street Kensington, London, W8",Retirement Property,/properties/136193309#/?channel=RES_LET,N/A
"£2,050 pcm","Rectory Road, London, N16",Apartment,/properties/136193291#/?channel=RES_LET,2
"£1,798 pcm","Wharfside point South, 4 Preston Road, Blackwall, Canary Wharf, London, E14 9EX",Flat,/properties/136193216#/?channel=RES_LET,1
"£2,300 pcm",Lakeside Drive London NW10,Apartment,/properties/134788784#/?channel=RES_LET,1
"£1,600 pcm","Coombe Hill House, London, SW20",Apartment,/properties/136193207#/?channel=RES_LET,1
"£2,297 pcm","Charrington Tower, 11 Biscayne Avenue, Blackwall, Canary Wharf, London, E14 9AY",Flat,/properties/136193141#/?channel=RES_LET,1
"£4,312 pcm","Norland Square, Notting Hill",Flat,/properties/136193132#/?channel=RES_LET,1
"£2,297 pcm","Charrington Tower, Fairmont Avenue, Canary Wharf, London, E14 9PB",Flat,/properties/136193078#/?channel=RES_LET,1
"£7,692 pcm","The Sherwood, Soho, London, W1F",Flat,/properties/136193069#/?channel=RES_LET,3
"£1,599 pcm","Corringham Court, Corringham Road, London, NW11",Apartment,/properties/136193054#/?channel=RES_LET,1
"£2,496 pcm","Aynhoe Road, Brook Green, London, W14 ",Apartment,/properties/122255267#/?channel=RES_LET,2
"£2,650 pcm","Capital House, 4 Plaza Gardens, London, SW15 2DJ",Flat,/properties/136193033#/?channel=RES_LET,2
"£3,120 pcm","Manchester Street, Marylebone",Flat,/properties/135934352#/?channel=RES_LET,2
"£3,250 pcm","Manchester Street, Marylebone",Flat,/properties/136074794#/?channel=RES_LET,1
"£5,997 pcm","Bryanston Square, Marylebone",Flat,/properties/86182260#/?channel=RES_LET,2
"£2,950 pcm","Townmead Road, Imperial Wharf, SW6 2FJ",Apartment,/properties/136192991#/?channel=RES_LET,1
"£5,015 pcm","Nine Elms Lane, London, SW11",Apartment,/properties/136192883#/?channel=RES_LET,3
"£1,733 pcm","Michigan Building, 1 Fairmount Avenue, Blackwall, Canary Wharf, London, E14 9QT",Studio,/properties/136192934#/?channel=RES_LET,1
"£2,850 pcm","Anerley Park, Anerley , London, SE20",House,/properties/136192931#/?channel=RES_LET,4
"£1,450 pcm","Chatsworth Road, London",Flat,/properties/136192904#/?channel=RES_LET,1
"£2,500 pcm","Southwark Bridge Road, London, SE1",Apartment,/properties/135747713#/?channel=RES_LET,1
"£1,777 pcm","Burford Wharf Apartment, Cam Road, Stratford, London, E15 2SL",Flat,/properties/136192886#/?channel=RES_LET,1
"£2,167 pcm","Otter Close, Stratford, Pudding Mill Lane, Olympic Village, London, E15 2PX",Flat,/properties/136192862#/?channel=RES_LET,2
"£2,817 pcm","The Tower, One the Elephant, Elephant & Castle SE1",Apartment,/properties/136192856#/?channel=RES_LET,2
"£1,500 pcm","Coombe Hill House, London, SW20",Studio,/properties/136192847#/?channel=RES_LET,1
"£1,800 pcm","Woodland Road, London, SE19",Apartment,/properties/136192814#/?channel=RES_LET,2
"£2,253 pcm","Hailings Wharf, Channelsea Road, Straford, London, E15 2SX",Flat,/properties/136192802#/?channel=RES_LET,2
"£2,197 pcm","Shakespeare Road, Acton",Flat,/properties/136192769#/?channel=RES_LET,2
"£1,651 pcm","Vesta Court, City Walk, Long Lane, London, SE1",Apartment,/properties/86180151#/?channel=RES_LET,2
"£2,210 pcm","Gerry Raffles Square, Olympic Village, Stratford, Stratford Village, London, E15 1BG",Flat,/properties/136192781#/?channel=RES_LET,2
"£1,820 pcm","Fusion Court, Stratford, Maryland, London, E15 1JA",Apartment,/properties/136192751#/?channel=RES_LET,1
"£4,332 pcm","Nine Elms Lane, London, SW11",Apartment,/properties/136192631#/?channel=RES_LET,2
"£4,745 pcm","Finborough Road, Chelsea",Flat,/properties/136192709#/?channel=RES_LET,3
£780 pcm,"Block Wharf  Cuba street    (Canary Wharf), London, E14",Flat Share,/properties/81851030#/?channel=RES_LET,1
"£5,200 pcm","Flat 34, Countess House 10 Park Street London SW6 2QF",Apartment,/properties/136192658#/?channel=RES_LET,3
"£3,120 pcm","Manchester Street, Marylebone, London, W1U",Apartment,/properties/135932291#/?channel=RES_LET,1
"£1,750 pcm","Widdin Street, London, E15",End of Terrace,/properties/134999327#/?channel=RES_LET,2
"£1,755 pcm","Ontario Tower, 1 Fairmount Avenue, Blackwall, Canary Wharf, London, E14 9JD",Studio,/properties/136192625#/?channel=RES_LET,N/A
"£1,777 pcm","Ontario Tower, 1 Fairmont Avenue, Blackwall, Canary Wharf, London, E14 9JB",Studio,/properties/136192607#/?channel=RES_LET,1
"£4,087 pcm","Nine Elms Lane, London, SW11",Apartment,/properties/136191563#/?channel=RES_LET,2
"£3,250 pcm","Legacy Tower, 88 Great Eastern Road, Stratford, London, E15",Apartment,/properties/135445658#/?channel=RES_LET,3
"£2,253 pcm","New Tannery Way, Grange Road, London",Apartment,/properties/135439484#/?channel=RES_LET,1
"£1,777 pcm","Ontario Tower, 1 Fairmount Avenue, Blackwall, Canary Wharf, London, E14 9JD",Studio,/properties/136192556#/?channel=RES_LET,N/A
"£2,200 pcm","Perry Vale, London, SE23",Semi-Detached,/properties/136192523#/?channel=RES_LET,3
"£2,275 pcm","Kingsfield House, London, N16",Flat,/properties/136192517#/?channel=RES_LET,2
"£3,445 pcm","St. Quintin Avenue, London, W10",Flat,/properties/136192490#/?channel=RES_LET,3
"£2,200 pcm","Acton Lane, London, W4",Maisonette,/properties/136192484#/?channel=RES_LET,2
£825 pcm,"Friern Park, London, N12",House Share,/properties/136192475#/?channel=RES_LET,1
"£1,400 pcm","Fairfield Close, North Finchley",Apartment,/properties/136192457#/?channel=RES_LET,1
"£1,475 pcm","Florin Court, London, EC1M",Studio,/properties/136192454#/?channel=RES_LET,1
"£1,390 pcm","Hornsey Road, London, N19",Flat,/properties/136192445#/?channel=RES_LET,1
"£2,800 pcm","Latvia Court, London, SE17",Terraced,/properties/136192436#/?channel=RES_LET,2
"£2,167 pcm","Azura Court, 48 Warton Road, Stratford, London, E15 2JS",Apartment,/properties/136192412#/?channel=RES_LET,2
"£2,000 pcm","Aberdeen Road, Dollis Hill, Dollis Hill NW10",Flat,/properties/135580355#/?channel=RES_LET,1
"£1,850 pcm","Drakeley Court, London, N5",Flat,/properties/136192409#/?channel=RES_LET,1
"£1,650 pcm","Tierney Road, London, SW2",Flat,/properties/136192403#/?channel=RES_LET,1
"£1,850 pcm","Fernwood Avenue, London, SW16",Flat,/properties/136192400#/?channel=RES_LET,2
"£3,033 pcm","Millbank, London",Apartment,/properties/134968202#/?channel=RES_LET,1
"£4,550 pcm","Pattison Road, 
Childs Hill, NW2",Terraced,/properties/136013378#/?channel=RES_LET,4
"£2,249 pcm","Gun Wharf, 130 Wapping High Street, London, E1W 2NH",Apartment,/properties/136192382#/?channel=RES_LET,2
"£1,150 pcm","Fortis Green, London, N2",Studio,/properties/136192364#/?channel=RES_LET,1
"£1,850 pcm","Hendon Lane, London, N3",Flat,/properties/136192325#/?channel=RES_LET,2
"£1,712 pcm","Nickelby Apartments, 16 Grove Crescent Road, Stratford, London, E15 1AY",Flat,/properties/136192277#/?channel=RES_LET,1
"£2,150 pcm",Shad Thames London SE1,Apartment,/properties/136192280#/?channel=RES_LET,1
"£6,067 pcm","Portland Place, Marylebone, W1B",Apartment,/properties/130612652#/?channel=RES_LET,1
"£3,250 pcm","Manchester Street, Marylebone, London, W1U",Apartment,/properties/136073297#/?channel=RES_LET,1
"£3,750 pcm","Lyndhurst Road, London",Flat,/properties/135118541#/?channel=RES_LET,2
£950 pcm,"Tooting Bec / Balham, London, SW17",Flat Share,/properties/136192238#/?channel=RES_LET,1
"£2,102 pcm","Goulston Street, Spitalfields",Flat,/properties/136192196#/?channel=RES_LET,1
"£3,000 pcm","Bagshaw Building, Wardian, London",Caravan,/properties/136192211#/?channel=RES_LET,1
"£3,400 pcm","Kingsland Road, Haggerston, London, E8",Flat,/properties/136192145#/?channel=RES_LET,3
"£1,798 pcm",Seymour Place London W1H,Flat,/properties/136192148#/?channel=RES_LET,1
"£1,650 pcm","Basing Way, London, N3",Apartment,/properties/136192103#/?channel=RES_LET,2
"£2,058 pcm","Aden Grove, London, N16",Flat,/properties/136191722#/?channel=RES_LET,1
"£2,968 pcm","Stanlake Road, London, W12",Apartment,/properties/136192082#/?channel=RES_LET,3
"£3,500 pcm",Edgeley Road London SW4,Flat,/properties/136192073#/?channel=RES_LET,4
"£1,755 pcm","Westgate Apartments, 14 Western Gateway, Royal Victoria Dock, London, E16 1BP",Apartment,/properties/136192055#/?channel=RES_LET,1
"£1,755 pcm","Aegean Apartment, Capital East Apartments, Western Gateway, Royal Victoria Docks, London, E16 1AR",Apartment,/properties/136192007#/?channel=RES_LET,1
"£2,825 pcm",Lupus Street Pimlico SW1V,Apartment,/properties/86162445#/?channel=RES_LET,4
"£3,012 pcm","Dorset Square, Marylebone, London, NW1",Apartment,/properties/136192001#/?channel=RES_LET,1
"£4,000 pcm","Fulham Road, Chelsea SW3",Flat,/properties/135558869#/?channel=RES_LET,2
"£2,475 pcm","Caravel House, Treacle Works, Royal Wharf, E16",Flat,/properties/136191962#/?channel=RES_LET,3
"£1,993 pcm","Aberdeen Wharf, 94 Wapping High Street, Wapping",Apartment,/properties/136191917#/?channel=RES_LET,1
"£3,120 pcm",Manchester Street Marylebone W1U,Flat,/properties/135934304#/?channel=RES_LET,1
"£3,100 pcm","Hartfield Crescent, SW19",Flat,/properties/136191878#/?channel=RES_LET,2
"£2,150 pcm",Inverness Terrace London W2,Apartment,/properties/136191881#/?channel=RES_LET,1
"£1,700 pcm","Western Gateway, London, E16",Flat,/properties/136191854#/?channel=RES_LET,1
"£7,500 pcm","Chartfield Avenue, London, SW15",Detached,/properties/136190759#/?channel=RES_LET,5
"£3,250 pcm","Whitehouse Apartments, London, SE1",Flat,/properties/136178021#/?channel=RES_LET,2
"£3,250 pcm",Manchester Street London W1U,Apartment,/properties/136072634#/?channel=RES_LET,1
"£1,517 pcm","Median road, Clapton",Flat,/properties/128452328#/?channel=RES_LET,1
"£1,798 pcm","Seymour Place, London, W1H",Studio,/properties/136191815#/?channel=RES_LET,1
"£4,312 pcm","Wood Crescent, Television Centre, White City, London, W12",Apartment,/properties/136191773#/?channel=RES_LET,2
"£5,997 pcm",Bryanston Square London W1H,Apartment,/properties/86180766#/?channel=RES_LET,2
"£14,083 pcm","Apartment , Romney House, Marsham Street, Westminster, SW1P",Flat,/properties/133944608#/?channel=RES_LET,3
"£3,250 pcm","Montagu Road, London, NW4",Terraced,/properties/136046132#/?channel=RES_LET,4
"£2,150 pcm","Winter Apartments, East Acton Lane, W3",Apartment,/properties/136191707#/?channel=RES_LET,1
"£2,000 pcm","Peabody Estate, Fulham Palace Road, London, W6",Flat,/properties/67274252#/?channel=RES_LET,2
"£2,925 pcm","Queensway, London, W2",Apartment,/properties/134032271#/?channel=RES_LET,2
"£1,695 pcm","Camden Street, London, NW1",Flat,/properties/135932366#/?channel=RES_LET,1
"£2,297 pcm","Serapis House, Goodluck Hope, London, E14",Apartment,/properties/135146207#/?channel=RES_LET,1
"£5,997 pcm","Bryanston Square, Marylebone, London, W1H",Apartment,/properties/86180151#/?channel=RES_LET,2
"£4,225 pcm","Mansfield Street, Marylebone, London, W1G",Flat,/properties/136187957#/?channel=RES_LET,2
"£1,950 pcm","Hetherington Road, Brixton, London, SW4",House,/properties/136117331#/?channel=RES_LET,1
"£2,817 pcm","Streatley Road, London, NW6",Apartment,/properties/136191476#/?channel=RES_LET,3
"£1,127 pcm","Newton Court  Axio Way    (Bow road), London, E3",Flat Share,/properties/82259729#/?channel=RES_LET,1
"£8,667 pcm","Harbour Avenue, London",Apartment,/properties/136191416#/?channel=RES_LET,3
"£1,170 pcm","Block Wharf  Cuba street    (Canary Wharf), London, E14",Flat Share,/properties/81851027#/?channel=RES_LET,1
"£3,966 pcm","Nine Elms Lane, London, SW11",Apartment,/properties/136191263#/?channel=RES_LET,2
"£3,943 pcm","Allsop Place, Marylebone, London, NW1",Apartment,/properties/136191293#/?channel=RES_LET,2
"£3,942 pcm","Nine Elms Lane, London, SW11",Apartment,/properties/136191134#/?channel=RES_LET,2
"£1,257 pcm","242 Hornsey Road, Holloway / Arsenal",Apartment,/properties/136191209#/?channel=RES_LET,N/A
"£2,750 pcm","Brussels Road, London, SW11",Apartment,/properties/136191197#/?channel=RES_LET,2
"£1,600 pcm","Wricklemarsh Road, London, SE3",Flat,/properties/136191170#/?channel=RES_LET,2
"£2,350 pcm",Powis Street London SE18,Flat,/properties/136191119#/?channel=RES_LET,2
"£3,105 pcm","Nine Elms Lane, London, SW11",Apartment,/properties/136191011#/?channel=RES_LET,1
"£4,000 pcm","Admiralty House, London Dock, E1W",Apartment,/properties/135620564#/?channel=RES_LET,2
"£4,000 pcm","Emperors Gate, LONDON, SW7 4HJ",Flat,/properties/136191065#/?channel=RES_LET,2
£910 pcm,"The Sphere  Hallsville Road    (Canning town), London, E16",Flat Share,/properties/87272537#/?channel=RES_LET,1
"£3,025 pcm","Nine Elms Lane, London, SW11",Apartment,/properties/136190903#/?channel=RES_LET,1
"£6,283 pcm","One Crown Place, The City, EC2A",Apartment,/properties/135082829#/?channel=RES_LET,2
"£3,033 pcm","Gloucester Place, Marylebone, London, NW1",Apartment,/properties/136190918#/?channel=RES_LET,1
"£1,650 pcm","Keith Grove, London, W12",Apartment,/properties/136190912#/?channel=RES_LET,1
"£2,925 pcm","Manchester Street, Marylebone",Flat,/properties/136190906#/?channel=RES_LET,1
"£2,990 pcm","Queens Gardens, London",Apartment,/properties/136190897#/?channel=RES_LET,1
"£4,550 pcm","Pattison Road, Hampstead, NW2",House,/properties/135701165#/?channel=RES_LET,4
"£2,980 pcm","Nine Elms Lane, London, SW11",Apartment,/properties/136190615#/?channel=RES_LET,1
"£2,500 pcm","Beaufort Square, Colindale, NW9 ",Apartment,/properties/83452241#/?channel=RES_LET,2
"£4,785 pcm","Beresford Road, London, N5",Apartment,/properties/136211606#/?channel=RES_LET,2
"£2,200 pcm","River Street, Angel, London,EC1R",Apartment,/properties/136190741#/?channel=RES_LET,1
"£2,250 pcm","Melfield Gardens, London, SE6",House,/properties/57287370#/?channel=RES_LET,3
"£1,257 pcm","The Sphere  Hallsville Road    (Canning town), London, E16",Flat Share,/properties/87272519#/?channel=RES_LET,1
"£4,550 pcm",5 Pattison RoadLondon,Terraced,/properties/135346199#/?channel=RES_LET,4
"£4,550 pcm","Glentworth Street, Marylebone, London, NW1",Apartment,/properties/136190624#/?channel=RES_LET,3
"£3,198 pcm","Cascades Tower, E14",Flat,/properties/76007372#/?channel=RES_LET,3
"£2,925 pcm",33 Manchester Street London W1U,Apartment,/properties/136190576#/?channel=RES_LET,1
"£1,257 pcm","A Manilla Street    (Canary Wharf), London, E14",Flat Share,/properties/90563111#/?channel=RES_LET,1
"£1,900 pcm","Underhill Road, London, SE22",Flat,/properties/136190555#/?channel=RES_LET,2
"£3,142 pcm","Arena Tower, Canary Wharf, London, E14",Apartment,/properties/136190561#/?channel=RES_LET,2
"£2,400 pcm","Aegon House, 13 Lanark Square, Canary Wharf, London, E14",Apartment,/properties/136190537#/?channel=RES_LET,2
"£2,730 pcm","Upper Berkeley Street, Marylebone",Flat,/properties/135354656#/?channel=RES_LET,1
"£10,000 pcm","Elm Tree Court, 
Elm Tree Road, NW8",Flat,/properties/136191572#/?channel=RES_LET,3
"£5,997 pcm","Elm Tree Court, 
Elm Tree Road, NW8",Flat,/properties/136190465#/?channel=RES_LET,3
"£5,000 pcm","Somerville Avenue, 
Barnes, SW13",Flat,/properties/136190456#/?channel=RES_LET,3
"£1,400 pcm","Wightman Road, London, N4",Apartment,/properties/86188917#/?channel=RES_LET,1
"£2,500 pcm",Edgware Road London W2,Apartment,/properties/135755681#/?channel=RES_LET,2
"£2,492 pcm","Strand, London, WC2R",Apartment,/properties/136190432#/?channel=RES_LET,1
"£5,000 pcm","Peterborough House, Postmark, WC1X",Apartment,/properties/135610751#/?channel=RES_LET,2
"£3,077 pcm","Meranti house, London, E1",Flat,/properties/136190351#/?channel=RES_LET,1
"£2,950 pcm","Herbrand Street, WC1N",Flat,/properties/136190285#/?channel=RES_LET,2
"£1,650 pcm","Fothergill Drive, Winchmore Hill",Flat,/properties/136190288#/?channel=RES_LET,2
"£2,730 pcm","Upper Berkeley Street, London, W1H",Apartment,/properties/135345131#/?channel=RES_LET,1
"£3,012 pcm","St Dunstans House, 133-137 Fetter Lane, London, EC4A",Apartment,/properties/136060526#/?channel=RES_LET,1
"£11,917 pcm","Farmilo Road, London, E17",Apartment,/properties/86206653#/?channel=RES_LET,2
"£3,662 pcm","Latymer Court,, Hammersmith Road, London",Flat,/properties/136190153#/?channel=RES_LET,4
"£2,915 pcm","Nine Elms Lane, London, SW11",Studio,/properties/136189949#/?channel=RES_LET,1
"£1,400 pcm","Ground Floor, Ismaila Road",Flat,/properties/136190009#/?channel=RES_LET,2
"£2,050 pcm","Rectory Road, London, N16",Apartment,/properties/136189970#/?channel=RES_LET,1
"£1,450 pcm","Burnt Ash Hill, London",Flat,/properties/136189967#/?channel=RES_LET,1
"£2,450 pcm","Avonley Road, New Cross, London, SE14",End of Terrace,/properties/82159099#/?channel=RES_LET,3
"£2,235 pcm","The Gessner, 3 Watermead Way, London, N17 9QZ",Apartment,/properties/86164890#/?channel=RES_LET,1
"£2,610 pcm","Nine Elms Lane, London, SW11",Studio,/properties/136189862#/?channel=RES_LET,1
"£2,165 pcm","The Gessner, 3 Watermead Way, London, N17 9RF",Apartment,/properties/86164914#/?channel=RES_LET,1
"£2,460 pcm","Nine Elms Lane, London, SW11",Studio,/properties/136189757#/?channel=RES_LET,1
"£1,850 pcm","Wateville Road, London, N17",Terraced,/properties/120851054#/?channel=RES_LET,2
"£2,730 pcm","Upper Berkeley Street, Marylebone, London, W1H",Apartment,/properties/135345335#/?channel=RES_LET,1
"£2,492 pcm","Elsham Road, London, W14",Apartment,/properties/136189745#/?channel=RES_LET,2
"£3,200 pcm","Warwick Road, London W5",Flat,/properties/136189748#/?channel=RES_LET,3
"£10,833 pcm","Holland Park Court, Holland Park Gardens, W14",Apartment,/properties/136189751#/?channel=RES_LET,3
"£2,730 pcm","Rendel House, Goodluck Hope, London, E14",Apartment,/properties/136189715#/?channel=RES_LET,2
"£2,455 pcm","Nine Elms Lane, London, SW11",Studio,/properties/136189604#/?channel=RES_LET,1
"£3,033 pcm","Nell Gwynn House, Sloane Avenue, SW3",Flat,/properties/113529242#/?channel=RES_LET,1
"£2,000 pcm","St. Mary'S Road, Leyton Mill, Leyton, London, E10",Flat,/properties/136189640#/?channel=RES_LET,3
"£2,708 pcm","Munster Square, Euston NW1",Flat,/properties/136189643#/?channel=RES_LET,2
"£1,550 pcm","Latchingdon Court, Forest Road, London",Flat,/properties/136189586#/?channel=RES_LET,1
"£4,914 pcm","Garrett Mansions, Paddington, London, W2",Apartment,/properties/136189595#/?channel=RES_LET,1
"£1,250 pcm","Boyton Road, Hornsey, N8",Flat,/properties/136189517#/?channel=RES_LET,1
"£3,450 pcm","Green Walk, London",Apartment,/properties/136189502#/?channel=RES_LET,2
