"£2,000 pcm","Palatine Road, Stoke Newington",Apartment,/properties/136198745#/?channel=RES_LET,1
"£2,500 pcm","Stanton House, SE10",Flat,/properties/136220483#/?channel=RES_LET,3
"£2,000 pcm","Two Bedroom Mews House, Lea Bridge Road, London - £2000 PCM",Semi-Detached,/properties/136220480#/?channel=RES_LET,2
"£3,000 pcm","Guildford Road, Walthamstow E17",House,/properties/136220471#/?channel=RES_LET,3
"£2,300 pcm","Manbey Park Road, Stratford, E15",Flat,/properties/136220459#/?channel=RES_LET,3
"£2,500 pcm","Fulbourne Road, Walthamstow E17",House,/properties/136220453#/?channel=RES_LET,3
"£2,500 pcm","Wilshaw House, SE8",Flat,/properties/136220438#/?channel=RES_LET,3
"£3,250 pcm","Moore House, Grosvenor Waterside , Gatliff Road",Apartment,/properties/136220417#/?channel=RES_LET,1
"£2,201 pcm","Stylus House, Devonport Street, London, E1",Apartment,/properties/136220414#/?channel=RES_LET,2
"£5,750 pcm",Eleanor Road London E8,House,/properties/135034160#/?channel=RES_LET,4
"£2,400 pcm","New River Crescent, Palmers Green, N13",Terraced,/properties/136220270#/?channel=RES_LET,3
"£2,000 pcm",St. Johns Wood Road London NW8,Apartment,/properties/136125800#/?channel=RES_LET,7
"£2,145 pcm","Archel Road, London, W14",Flat,/properties/136220177#/?channel=RES_LET,2
"£1,199 pcm","Hornsey Park Road, London, N8",Studio,/properties/136220156#/?channel=RES_LET,1
"£2,800 pcm","The Woodlands, London, SE13",Terraced,/properties/136220135#/?channel=RES_LET,3
"£2,500 pcm","Brixton, London, SW2",Flat,/properties/136220153#/?channel=RES_LET,3
"£1,750 pcm","Dacres Road, London, SE23",Flat,/properties/134840408#/?channel=RES_LET,2
"£3,142 pcm","Gosfield Street, London, W1",Flat,/properties/136219967#/?channel=RES_LET,2
"£1,300 pcm","390 Stocksfield Road, Walthamstow, E17",Flat,/properties/134532980#/?channel=RES_LET,1
"£1,475 pcm","High Road, London, N20",Apartment,/properties/136219835#/?channel=RES_LET,1
"£1,700 pcm","Westcombe Hill, Blackheath, SE3",Apartment,/properties/136219751#/?channel=RES_LET,2
"£9,317 pcm","Queensmead, 
St. Johns Wood Park, NW8",House,/properties/136005563#/?channel=RES_LET,4
"£5,995 pcm","Gordon Road London, W5 (EPC E)",Detached,/properties/136219688#/?channel=RES_LET,5
"£2,500 pcm","Green Lane, SW16",Semi-Detached,/properties/135408359#/?channel=RES_LET,3
"£4,500 pcm","Melbury Gardens, West Wimbledon, SW20",House,/properties/136219451#/?channel=RES_LET,3
"£2,000 pcm","Palatine Road, London",Flat,/properties/136219406#/?channel=RES_LET,1
"£1,350 pcm","High Road, South Woodford, E18",Apartment,/properties/136219385#/?channel=RES_LET,1
"£2,600 pcm","Fairbridge Road, Islington, N19",Maisonette,/properties/136219295#/?channel=RES_LET,3
"£1,790 pcm","Denison Close, London, East Finchley, N2",Flat,/properties/135139949#/?channel=RES_LET,2
"£2,817 pcm","HKR Hoxton, Scawfell Street, Hoxton E2",Apartment,/properties/136226318#/?channel=RES_LET,1
"£1,798 pcm","City Island Way, Canning Town",Flat,/properties/136219076#/?channel=RES_LET,N/A
"£2,197 pcm","Barrier Point Road, North Woolwich",Flat,/properties/136219073#/?channel=RES_LET,2
"£1,475 pcm","High Road, London, N20",Apartment,/properties/136219058#/?channel=RES_LET,1
"£2,297 pcm","Biscayne Avenue, Canary Wharf",Flat,/properties/136219052#/?channel=RES_LET,1
"£1,798 pcm","Fairmont Avenue, Canary Wharf",Flat,/properties/136219049#/?channel=RES_LET,1
"£1,650 pcm","Louisa Oakes Close, Chingford Mount, E4",Apartment,/properties/136219001#/?channel=RES_LET,2
"£3,575 pcm","St Johns Hill, St John's Hill, London, SW11",Apartment,/properties/86157624#/?channel=RES_LET,2
"£1,525 pcm","Brymay Close, London, E3",Flat,/properties/136218998#/?channel=RES_LET,1
"£2,950 pcm","Golders Green Road, London, NW11",Flat,/properties/135694010#/?channel=RES_LET,3
"£2,350 pcm","Chelmer Road, London, E9",Flat,/properties/136218965#/?channel=RES_LET,2
"£2,000 pcm","City Road, London, EC1Y",Studio,/properties/136218968#/?channel=RES_LET,1
"£2,700 pcm","Hendon Way, London, NW2",Flat,/properties/135809912#/?channel=RES_LET,2
"£2,300 pcm","Grove Road, London, E3",Flat,/properties/136218959#/?channel=RES_LET,2
"£3,300 pcm","Stockton Court, London, SW1P",Flat,/properties/136218929#/?channel=RES_LET,2
"£2,800 pcm","Park West, London, W2",Flat,/properties/136218935#/?channel=RES_LET,1
"£2,200 pcm","Eclipse Road, London, E13",Terraced,/properties/136218941#/?channel=RES_LET,4
"£1,750 pcm","Mountview Road, London, N4",Flat,/properties/136218950#/?channel=RES_LET,1
"£1,600 pcm","Dermody Road, London, SE13",Flat,/properties/136218923#/?channel=RES_LET,1
"£2,100 pcm","Schooner Close, London, E14",Maisonette,/properties/136218926#/?channel=RES_LET,2
"£3,310 pcm","Xavier Building, 10 Westfield Avenue, London, E20",Apartment,/properties/136218662#/?channel=RES_LET,2
"£2,899 pcm","Lyell Street, Canary Wharf",Flat,/properties/136218794#/?channel=RES_LET,2
"£2,102 pcm","Blackwall Way, Canary Wharf",Flat,/properties/136218791#/?channel=RES_LET,1
"£2,817 pcm","Westferry Circus, Canary Wharf",Flat,/properties/136218788#/?channel=RES_LET,2
"£5,417 pcm","Dollar Bay Place, Canary Wharf",Flat,/properties/136218779#/?channel=RES_LET,3
"£2,297 pcm","Biscayne Avenue, Canary Wharf",Flat,/properties/136218770#/?channel=RES_LET,1
"£1,798 pcm","Fairmont Avenue, Canary Wharf",Flat,/properties/136218764#/?channel=RES_LET,1
"£5,500 pcm","Colville Gardens, Notting Hill, W11",Flat,/properties/133993259#/?channel=RES_LET,2
"£2,715 pcm","31 Harbour Way, London, E14",Apartment,/properties/116335127#/?channel=RES_LET,1
"£4,116 pcm","Triton Building, Brock Street, London NW1",Flat,/properties/136218713#/?channel=RES_LET,2
"£2,600 pcm","Copperfield Road, Mile End, London",Apartment,/properties/136218659#/?channel=RES_LET,2
"£1,400 pcm","Avenue Road, N6 5DS",Apartment,/properties/136218641#/?channel=RES_LET,1
"£7,367 pcm","Sunningfields Road, Hendon, NW4",Not Specified,/properties/136132229#/?channel=RES_LET,3
"£2,610 pcm","Xavier Building, 10 Westfield Avenue, London, E20",Apartment,/properties/136218536#/?channel=RES_LET,1
"£2,600 pcm","College Green, London, SE19",Terraced,/properties/110867147#/?channel=RES_LET,3
"£1,300 pcm","Miles Drive, London, SE28 0JA",Flat,/properties/136218572#/?channel=RES_LET,1
"£2,510 pcm","Xavier Building, 10 Westfield Avenue, London, E20",Apartment,/properties/136218269#/?channel=RES_LET,1
"£2,000 pcm","Arlington Gardens, Chiswick, W4",Apartment,/properties/134796656#/?channel=RES_LET,2
"£2,999 pcm",Devonshire Terrace Bayswater W2,Apartment,/properties/134861429#/?channel=RES_LET,2
"£2,000 pcm","Uxbridge Road, London, W12",Apartment,/properties/136218272#/?channel=RES_LET,3
"£3,000 pcm","West Tenter Street, 
Tower Bridge, E1",Flat,/properties/136218251#/?channel=RES_LET,3
"£2,635 pcm","Xavier Building, 10 Westfield Avenue, London, E20",Apartment,/properties/136218077#/?channel=RES_LET,1
"£2,000 pcm","Coldharbour Lane, Brixton",Flat,/properties/126243482#/?channel=RES_LET,2
"£2,249 pcm","New Providence Wharf, Canary Wharf",Flat,/properties/136218119#/?channel=RES_LET,1
"£1,900 pcm","Patterson Tower, Kidbrooke Village, Kidbrooke Park Road, SE3",Apartment,/properties/136218104#/?channel=RES_LET,1
"£1,825 pcm","Chase Side, Southgate, N14",House,/properties/136218014#/?channel=RES_LET,3
"£2,000 pcm",3 Casbeard Street,Flat,/properties/135992114#/?channel=RES_LET,1
"£2,195 pcm","Ada Street, London, E8",Apartment,/properties/136132037#/?channel=RES_LET,2
"£1,450 pcm","Bycullah Road, Enfield",Apartment,/properties/134645303#/?channel=RES_LET,1
"£1,800 pcm","Kilburn Lane,  London, W10",Maisonette,/properties/136217903#/?channel=RES_LET,2
"£2,102 pcm","Bickley Street, Tooting Broadway, SW17",Flat,/properties/136217894#/?channel=RES_LET,2
"£1,750 pcm","Muswell Avenue, Muswell Hill, London",Flat,/properties/132849617#/?channel=RES_LET,3
"£2,600 pcm","Xavier Building, 10 Westfield Avenue, London, E20",Apartment,/properties/136217624#/?channel=RES_LET,1
"£3,033 pcm","Sloane Avenue, SW3",Studio,/properties/86145156#/?channel=RES_LET,1
"£1,625 pcm","Cumberland Park, W3",Apartment,/properties/136217813#/?channel=RES_LET,1
"£2,301 pcm","Conduit Way, Stonebridge, London, NW10",House,/properties/136217792#/?channel=RES_LET,3
"£2,249 pcm","New Providence Wharf, Canary Wharf",Flat,/properties/136217768#/?channel=RES_LET,1
"£3,000 pcm","56 De Beauvoir Crescent, London, N1",Apartment,/properties/113453588#/?channel=RES_LET,1
"£3,750 pcm","Bushey Hill Road,  London, SE5",Terraced,/properties/135937397#/?channel=RES_LET,4
"£1,000 pcm","Wedmore Gardens, Archway, N19",Flat,/properties/136217744#/?channel=RES_LET,1
"£2,100 pcm","Sandringham Ave, Wimbledon Chase, SW20 8JY",Flat,/properties/135567170#/?channel=RES_LET,2
£700 pcm,"Woodberry Grove, Finsbury Park",House Share,/properties/125865770#/?channel=RES_LET,N/A
"£1,450 pcm","Bushey Road, Raynes Park, London, SW20 0JF",Flat,/properties/134781983#/?channel=RES_LET,1
"£5,000 pcm","Lawford Road, 
De Beauvoir, N1",Terraced,/properties/136217630#/?channel=RES_LET,3
"£2,575 pcm","Xavier Building, 10 Westfield Avenue, London, E20",Apartment,/properties/136217453#/?channel=RES_LET,1
"£6,283 pcm","Gloucester Avenue, Primrose Hill, NW1",House,/properties/136217597#/?channel=RES_LET,5
"£3,500 pcm","Omega Place, London, N1",Flat,/properties/136217567#/?channel=RES_LET,2
"£2,250 pcm","Ludo Building, London, SW18",Flat,/properties/136217558#/?channel=RES_LET,2
"£3,000 pcm","Tennyson Road, London, NW6",Terraced,/properties/136217555#/?channel=RES_LET,2
"£1,825 pcm","Royal Carriage Mews, London, SE18",Flat,/properties/134605928#/?channel=RES_LET,1
"£3,230 pcm","Xavier Building, 10 Westfield Avenue, London, E20",Apartment,/properties/136217261#/?channel=RES_LET,2
"£3,000 pcm","Axminster Road, Holloway",Flat,/properties/135616223#/?channel=RES_LET,3
"£2,600 pcm","Walton Street, Knightsbridge",Flat,/properties/134322515#/?channel=RES_LET,1
"£2,590 pcm","Xavier Building, 10 Westfield Avenue, London, E20",Apartment,/properties/136216889#/?channel=RES_LET,1
"£2,097 pcm","Minster Road, West Hampstead NW2",Flat,/properties/136217183#/?channel=RES_LET,1
"£1,450 pcm","Shooters Hill Road, Blackheath, SE3",Flat,/properties/136216991#/?channel=RES_LET,1
"£3,397 pcm","Fordwych Road, West Hampstead NW2",Flat,/properties/136216955#/?channel=RES_LET,3
"£2,100 pcm","Mauleverer Road, London, SW2",Apartment,/properties/136216928#/?channel=RES_LET,2
"£3,745 pcm","Midhurst Road, Ealing",House,/properties/134942036#/?channel=RES_LET,5
"£1,175 pcm","Room Rent - Maida Vale, London",Flat Share,/properties/136216898#/?channel=RES_LET,1
"£1,798 pcm","Exeter Road, Kilburn NW2",Flat,/properties/136216865#/?channel=RES_LET,1
"£2,250 pcm","Sutton Court Road, Chiswick, W4",Apartment,/properties/136216754#/?channel=RES_LET,2
"£1,950 pcm","Three Colt Street, E14",Apartment,/properties/124427126#/?channel=RES_LET,2
"£4,116 pcm","Latitude House, Oval Road, Camden, London, NW1",Apartment,/properties/136216751#/?channel=RES_LET,2
"£2,925 pcm","Sloane Avenue, Chelsea, SW3",Flat,/properties/136216724#/?channel=RES_LET,1
"£3,575 pcm","Queens Gate, South Kensington, SW7",Flat,/properties/136216718#/?channel=RES_LET,2
"£2,300 pcm","Voltaire Road, Clapham",Apartment,/properties/136216640#/?channel=RES_LET,3
"£2,250 pcm","Amwell Street, Islington, EC1R",Flat,/properties/136216631#/?channel=RES_LET,1
"£2,650 pcm","Pennard Road, W12",Flat,/properties/136216538#/?channel=RES_LET,3
"£2,595 pcm","Cherry Park Lane, London, E20",Apartment,/properties/136216355#/?channel=RES_LET,1
"£2,250 pcm","Bruce House, 
St. Charles Square, W10",Flat,/properties/136216415#/?channel=RES_LET,2
"£2,123 pcm","Bridgewater House, London City Island, Canning Town E14",Apartment,/properties/136216424#/?channel=RES_LET,1
"£1,250 pcm",Manor Park Lee SE13,Apartment,/properties/136216391#/?channel=RES_LET,1
"£4,000 pcm","Baring Street, Islington, N1",Terraced,/properties/136216298#/?channel=RES_LET,3
"£1,800 pcm","Cromford Road, Wandsworth, SW18",Apartment,/properties/136216271#/?channel=RES_LET,1
"£2,600 pcm",George Crescent London N10,Terraced,/properties/135561332#/?channel=RES_LET,3
"£2,320 pcm","Cherry Park Lane, London, E20",Studio,/properties/136215236#/?channel=RES_LET,1
"£3,033 pcm","Sidney Street, London, E1",Apartment,/properties/135006119#/?channel=RES_LET,2
"£4,250 pcm","Jubilee Heights, Parkside Avenue, Greenwich, SE10",Flat,/properties/81576225#/?channel=RES_LET,2
£850 pcm,"West India Dock Road, London, E14",Flat Share,/properties/136216052#/?channel=RES_LET,1
£875 pcm,"Kingsland Road, London, E2",Flat Share,/properties/136216055#/?channel=RES_LET,1
"£1,195 pcm","Fentiman Road, London, SW8",Terraced,/properties/136227452#/?channel=RES_LET,6
"£1,960 pcm","Homefield Road, Wimbledon Village, SW19",Apartment,/properties/135447731#/?channel=RES_LET,1
"£3,081 pcm","6 Vine Hill, London, EC1R",Apartment,/properties/135964838#/?channel=RES_LET,2
"£2,900 pcm","Newman Street, London, W1T",Flat,/properties/136214750#/?channel=RES_LET,1
"£1,600 pcm","Park View Road, W5",Studio,/properties/136215956#/?channel=RES_LET,1
"£2,800 pcm","Royal Tower Lodge, London, E1",Flat,/properties/86202612#/?channel=RES_LET,2
"£4,333 pcm","Exchange Gardens, London, SW8 1BG, UK",Terraced,/properties/136031615#/?channel=RES_LET,4
"£1,950 pcm","West Hill, London, SW15",Flat,/properties/86145618#/?channel=RES_LET,2
"£1,800 pcm","Park View Road, W5",Studio,/properties/136215839#/?channel=RES_LET,1
"£1,700 pcm","Park View Road, W5",Studio,/properties/136215818#/?channel=RES_LET,1
"£2,000 pcm","Park View Road, W5",Studio,/properties/136215788#/?channel=RES_LET,1
"£2,500 pcm","Parkfield Road, London, NW10",Semi-Detached,/properties/111289247#/?channel=RES_LET,2
"£3,200 pcm","Onyx Apartemnts, Camley Street, Kings Cross, London, N1C",Apartment,/properties/82874625#/?channel=RES_LET,2
"£3,315 pcm","Great Dover Street, Borough, London, SE1 4EG",Maisonette,/properties/136215728#/?channel=RES_LET,3
"£1,050 pcm","Brecknock Road, London N19",House Share,/properties/136215731#/?channel=RES_LET,2
"£2,700 pcm","Aldersbrook Road, Manor Park E12",Detached,/properties/134857184#/?channel=RES_LET,3
"£3,142 pcm","Gosfield Street, London W1W",Flat,/properties/136215623#/?channel=RES_LET,1
"£1,700 pcm","Bazely Street, Poplar, London, E14",Apartment,/properties/89142725#/?channel=RES_LET,2
"£3,467 pcm","Wallace Road, 
Islington, N1",Apartment,/properties/136215470#/?channel=RES_LET,2
"£3,358 pcm","Goldhurst Terrace, South Hampstead, London",Flat,/properties/136215413#/?channel=RES_LET,3
"£2,197 pcm","Ashby Road, London, N15",Terraced,/properties/135812954#/?channel=RES_LET,3
"£4,250 pcm","Grafton Road, London, NW5",Apartment,/properties/136215422#/?channel=RES_LET,4
"£3,600 pcm","130 Grove Road, London",Flat,/properties/135147962#/?channel=RES_LET,4
"£2,800 pcm","Caravel Close, London",Flat,/properties/135259478#/?channel=RES_LET,3
"£2,318 pcm","Discovery Dock East, South Quay Square, E14",Apartment,/properties/136179470#/?channel=RES_LET,1
"£2,578 pcm","Bryanston Place, Marylebone W1H",Flat,/properties/136215293#/?channel=RES_LET,2
"£1,650 pcm",Hartfield Road,Flat,/properties/136215251#/?channel=RES_LET,1
"£7,000 pcm","Petyward, Chelsea Green, SW3",Apartment,/properties/136215233#/?channel=RES_LET,3
"£1,950 pcm","Talbot Road, Notting Hill, W2",Flat,/properties/134161184#/?channel=RES_LET,1
"£1,950 pcm","Ribblesdale Road, London, SW16",Flat,/properties/136215203#/?channel=RES_LET,2
"£2,150 pcm","Union Road, London, SW4",Flat,/properties/136215209#/?channel=RES_LET,2
"£2,500 pcm","Rembrandt Close, E14",House,/properties/135621608#/?channel=RES_LET,2
"£2,150 pcm","Credenhill Street, London, SW16",Flat,/properties/136215194#/?channel=RES_LET,2
"£3,302 pcm","Lewis Cubitt Walk, London, N1C",Apartment,/properties/136215170#/?channel=RES_LET,1
"£2,490 pcm","Cherry Park Lane, London, E20",Apartment,/properties/136214933#/?channel=RES_LET,1
"£1,600 pcm","Fernwood Crescent, London",Flat,/properties/136215029#/?channel=RES_LET,N/A
"£3,000 pcm","Leontine Close, London, SE15 1UH",Maisonette,/properties/135358541#/?channel=RES_LET,4
£950 pcm,"Lincoln Crescent, Enfield, EN1",End of Terrace,/properties/136214900#/?channel=RES_LET,1
"£1,750 pcm","Maygrove Road, West Hampstead, NW6",Flat,/properties/134998025#/?channel=RES_LET,2
"£3,497 pcm","Pan Peninsula Square, London, E14",Flat,/properties/136214789#/?channel=RES_LET,1
"£2,200 pcm","Northwood Road, London, N6",Flat,/properties/136214771#/?channel=RES_LET,1
"£2,150 pcm","Channelsea Road, London, E15",Flat,/properties/136214765#/?channel=RES_LET,2
"£1,700 pcm","St. Davids Square, London, E14",Flat,/properties/136214741#/?channel=RES_LET,1
"£3,900 pcm","Downside Crescent, Belsize Park, London, NW3",Flat,/properties/136214702#/?channel=RES_LET,3
"£2,200 pcm","Weardale Road, London, SE13",Penthouse,/properties/136214705#/?channel=RES_LET,2
"£2,825 pcm","Cherry Park Lane, London, E20",Apartment,/properties/136214399#/?channel=RES_LET,2
"£1,712 pcm",Orsett Terrace Bayswater W2,Apartment,/properties/133594046#/?channel=RES_LET,1
"£1,998 pcm",Homer Street Marylebone W1H,Apartment,/properties/132470294#/?channel=RES_LET,1
"£1,950 pcm","Willesden Lane, London, NW6",Apartment,/properties/136214588#/?channel=RES_LET,1
"£1,250 pcm","Odessa Street, London, SE16",Flat Share,/properties/135071390#/?channel=RES_LET,1
"£2,817 pcm",Ryders Terrace London NW8,House,/properties/133508198#/?channel=RES_LET,2
"£1,750 pcm","Hither Green Lane, Hither Green, London, SE13",Flat,/properties/136214234#/?channel=RES_LET,2
"£1,800 pcm","Dartmouth Road, London, SE26",Maisonette,/properties/136214201#/?channel=RES_LET,2
"£2,830 pcm","Cherry Park Lane, London, E20",Apartment,/properties/136213985#/?channel=RES_LET,2
"£2,700 pcm","Westferry Road, Canary Wharf",Flat,/properties/136213898#/?channel=RES_LET,2
"£2,825 pcm","Cherry Park Lane, London, E20",Apartment,/properties/136213454#/?channel=RES_LET,2
"£3,235 pcm",Woolwich Church Street Woolwich SE18,Flat,/properties/135309194#/?channel=RES_LET,2
"£3,500 pcm","Mortimer Road, London, NW10",Terraced,/properties/136213799#/?channel=RES_LET,5
"£6,283 pcm",9 Millbank,Flat,/properties/136213739#/?channel=RES_LET,2
"£2,475 pcm","Upper Street, London, N1",Flat,/properties/135058943#/?channel=RES_LET,2
"£1,900 pcm","Poplar Grove, Wembley, HA9",Flat,/properties/136173950#/?channel=RES_LET,1
"£2,500 pcm",Levy Building - P2009,Flat,/properties/136213370#/?channel=RES_LET,1
"£2,850 pcm","Clapham Road, London, SW9",Flat,/properties/136213181#/?channel=RES_LET,2
"£1,478 pcm","Albatross Close, London, E6",Flat,/properties/136213151#/?channel=RES_LET,1
"£1,900 pcm","Gambole Road, London, SW17",Maisonette,/properties/136213130#/?channel=RES_LET,2
"£2,300 pcm","Capstan Way, London, SE16",Terraced,/properties/136213097#/?channel=RES_LET,2
"£2,350 pcm","Denham Street, Greenwich, SE10",End of Terrace,/properties/136213100#/?channel=RES_LET,3
"£2,816 pcm","Maudlins Green, London, E1W",Maisonette,/properties/136213103#/?channel=RES_LET,3
"£2,250 pcm","Imperial Hall, London, EC1V",Flat,/properties/136213112#/?channel=RES_LET,1
"£3,600 pcm","Greswell Street, London, SW6",Flat,/properties/136213115#/?channel=RES_LET,2
"£2,000 pcm","Plashet Grove, London, E6",Flat,/properties/136213118#/?channel=RES_LET,3
"£1,378 pcm","Redding House, London, SE18",Flat,/properties/136213121#/?channel=RES_LET,1
"£1,799 pcm","Makers Yard, London, E3",Studio,/properties/136015019#/?channel=RES_LET,N/A
"£2,195 pcm","Lock Side Way, London, E16",Apartment,/properties/136213013#/?channel=RES_LET,2
"£1,898 pcm","Bromyard Avenue, Acton W3 7JD",Apartment,/properties/136026308#/?channel=RES_LET,2
"£3,878 pcm","Lexham Gardens, London, W8",Apartment,/properties/136212761#/?channel=RES_LET,2
"£3,500 pcm","Sandmere Road, London, SW4",Maisonette,/properties/136123496#/?channel=RES_LET,3
"£2,000 pcm","Elderfield Road, London, E5",Flat,/properties/135876053#/?channel=RES_LET,2
"£6,717 pcm","Edgware Road, London, W2",Apartment,/properties/116791682#/?channel=RES_LET,2
"£8,233 pcm","Edgware Road, London, W2",Apartment,/properties/113267762#/?channel=RES_LET,3
"£4,316 pcm","Edgware Road, London, W2",Apartment,/properties/96405137#/?channel=RES_LET,1
"£2,600 pcm","Azura Court, E15",Flat,/properties/136222475#/?channel=RES_LET,1
"£1,850 pcm","Peckham Rye, London, SE15",Flat,/properties/86166720#/?channel=RES_LET,2
"£5,200 pcm","Merchant Square East, London, W2",Apartment,/properties/102332648#/?channel=RES_LET,3
"£2,383 pcm","Hamlet Gardens, London, W6",Apartment,/properties/136067060#/?channel=RES_LET,1
"£7,583 pcm","Thornes House, London, SW11",Apartment,/properties/136070462#/?channel=RES_LET,1800
"£4,983 pcm","Hamlet Gardens, London, W6",Apartment,/properties/133989209#/?channel=RES_LET,3
"£3,900 pcm","Edgware Road, London, W2",Apartment,/properties/134927414#/?channel=RES_LET,1
"£3,142 pcm","Kensington Gardens Square, London, W2",Apartment,/properties/136040102#/?channel=RES_LET,1
"£1,675 pcm","High Road, London, N20",Apartment,/properties/136211606#/?channel=RES_LET,2
"£1,450 pcm","High Road, London, N20",Apartment,/properties/136211597#/?channel=RES_LET,1
"£24,266 pcm","Duke Street, London, W1K",Apartment,/properties/136210898#/?channel=RES_LET,3
"£1,350 pcm","Elderwood Place, West Norwood, London, SE27",Apartment,/properties/120401150#/?channel=RES_LET,1
"£1,500 pcm","Streatham Hill, London, SW2",Apartment,/properties/114523784#/?channel=RES_LET,1
"£1,850 pcm","Watchfield Court, Sutton Court Road, Chiswick, London, W4",Apartment,/properties/136210880#/?channel=RES_LET,1
"£3,050 pcm","Fairlawn Mansions, New Cross Road, London, SE14",Not Specified,/properties/133898648#/?channel=RES_LET,4
"£2,817 pcm","Egerton Gardens, London, SW3",Apartment,/properties/136029365#/?channel=RES_LET,1
"£2,817 pcm","Vision House, Peerless Street, London, EC1V",Apartment,/properties/119008115#/?channel=RES_LET,2
"£5,250 pcm","Bernard Gardens, London, SW19",Not Specified,/properties/136210778#/?channel=RES_LET,5
"£2,500 pcm","Hill Road, Mitcham, CR4",Terraced,/properties/136210754#/?channel=RES_LET,3
"£5,200 pcm","8 Casson Square, London, SE1",Flat,/properties/135705035#/?channel=RES_LET,2
"£2,900 pcm","Astell House, London, E14",Flat,/properties/136210550#/?channel=RES_LET,2
"£3,748 pcm","Carnation Way, Thames City, SW8",Apartment,/properties/135617636#/?channel=RES_LET,1
"£5,850 pcm","Carnation Way, Thames City, SW8",Apartment,/properties/135617729#/?channel=RES_LET,3
"£4,875 pcm","Carnation Way, Thames City, SW8",Apartment,/properties/135617903#/?channel=RES_LET,2
"£2,968 pcm","Churchyard Row, SE11",Apartment,/properties/135954143#/?channel=RES_LET,2
"£2,000 pcm","120 Finchley Road, London, NW3 5JB",Flat,/properties/76299111#/?channel=RES_LET,1
"£6,478 pcm","Ravensbourne Apartments, 5 Central Avenue, SW6",Apartment,/properties/134821871#/?channel=RES_LET,2
"£3,358 pcm","Ice Wharf, 17 New Wharf Road, N1",Apartment,/properties/136210331#/?channel=RES_LET,2
"£2,195 pcm","The Gessner, 3 Watermead Way, London, N17 9RF",Apartment,/properties/136210163#/?channel=RES_LET,1
"£2,000 pcm","Baytree Road, Brixton London, SW2",Flat,/properties/136169516#/?channel=RES_LET,2
"£1,800 pcm","Comber House, Comber Grove SE5 0LJ",Flat,/properties/136210097#/?channel=RES_LET,2
"£7,999 pcm","St. George Wharf, London, SW8",Apartment,/properties/136210013#/?channel=RES_LET,3
"£2,578 pcm","Moore House, Grosvenor Waterside, 2 Gatliff Road, London, SW1W",Apartment,/properties/136209989#/?channel=RES_LET,1
"£2,596 pcm","Moore House, Grosvenor Waterside, 2 Gatliff Road, London, SW1W",Apartment,/properties/136209992#/?channel=RES_LET,1
"£6,500 pcm","Nova, 83 Buckingham Palace Road, Westminster, London, SW1W",Apartment,/properties/134658605#/?channel=RES_LET,3
"£5,308 pcm","Bristol Mews, London, W9",Mews,/properties/136142711#/?channel=RES_LET,3
"£10,833 pcm","Cliveden Place, Sloane Square, London, SW1W",Apartment,/properties/132942101#/?channel=RES_LET,4
"£6,067 pcm","Portland Place, London, W1B",Apartment,/properties/135915935#/?channel=RES_LET,1
"£2,100 pcm","Marlborough Road, Royal Arsenal, London, SE18",Apartment,/properties/136209875#/?channel=RES_LET,2
"£1,700 pcm","Arthur Road, Holloway, London, N7",Terraced,/properties/135797159#/?channel=RES_LET,1
"£1,600 pcm","Windsor Road, Holloway, London, N7",Apartment,/properties/136168709#/?channel=RES_LET,1
"£1,750 pcm","4 Dunstan Mews, Enfield, EN1",Apartment,/properties/136209674#/?channel=RES_LET,2
"£2,492 pcm","Limerick Close, London, SW12",Flat,/properties/136209647#/?channel=RES_LET,3
"£1,750 pcm","Hollybush Hill, London, E11",Maisonette,/properties/136209488#/?channel=RES_LET,2
"£5,850 pcm","Strand, London, WC2R",Apartment,/properties/136209380#/?channel=RES_LET,3
"£2,925 pcm","Eamont Street, London, NW8",Apartment,/properties/136209368#/?channel=RES_LET,2
"£4,550 pcm","Weymouth Street, Fitzrovia, London, W1W",Apartment,/properties/136209377#/?channel=RES_LET,2
"£6,045 pcm","Basil Street, SW3",Apartment,/properties/136209344#/?channel=RES_LET,2
"£1,850 pcm","Cubitt Apartments, 36 Chatfield Road, SW11",Not Specified,/properties/136209335#/?channel=RES_LET,1
"£3,150 pcm","Munster Village, London, SW6",Flat,/properties/136209287#/?channel=RES_LET,3
"£1,400 pcm","Notting Hill Gate, London",Not Specified,/properties/136003220#/?channel=RES_LET,2
"£1,800 pcm","Pegwell Street, London, SE18",End of Terrace,/properties/134611412#/?channel=RES_LET,4
"£2,100 pcm","Bothwell Street, London, SW6",Flat,/properties/135602450#/?channel=RES_LET,2
